code;name;location;reference product;categories;ex_name;ex_amount;ex_unit;ex_product;ex_production volume;ex_type;ex_location;database;material_group
e30fa5080e11c09e61d1c8f13a953f52;treatment of aluminium scrap, post-consumer, prepared for recycling, at refiner;RoW;aluminium oxide, non-metallurgical;;market for zinc;0.011223378821739339;kilogram;zinc;0.0;technosphere;GLO;ecoinvent_cutoff_3.9_remind_SSP2-Base_2020;zinc
e44bd9e6678616d876f126232151867a;transistor production, wired, big size, through-hole mounting;GLO;transistor, wired, big size, through-hole mounting;;market for zinc;0.02842;kilogram;zinc;0.0;technosphere;GLO;ecoinvent_cutoff_3.9_remind_SSP2-Base_2020;zinc
e456e498b7115c23d1574c802769b1a1;rare earth oxides production, from rare earth oxide concentrate, 70% REO;CN-SC;gadolinium oxide;;market for zinc;0.00304357358622762;kilogram;zinc;0.0;technosphere;GLO;ecoinvent_cutoff_3.9_remind_SSP2-Base_2020;zinc
e883eef0fb87394fcbe126e37ef67a4d;purse seiner construction, wood;RLA;purse seiner, wood;;market for zinc;0.0002999190218640967;kilogram;zinc;0.0;technosphere;GLO;ecoinvent_cutoff_3.9_remind_SSP2-Base_2020;zinc
e8a4bf6eab47234fd72e2dda013ee22e;primary zinc production from concentrate;RoW;copper concentrate, sulfide ore;;market for zinc;0.0016692633306772215;kilogram;zinc;0.0;technosphere;GLO;ecoinvent_cutoff_3.9_remind_SSP2-Base_2020;zinc
ea97bd8ba864d9cd916c62aa74637b95;sodium arsenide production from Imperial smelting furnace;GLO;sodium arsenide;;market for zinc;0.52083;kilogram;zinc;0.0;technosphere;GLO;ecoinvent_cutoff_3.9_remind_SSP2-Base_2020;zinc
ecdbc114ea40e4f49905929ec4ad76ed;tractor production, 4-wheel, agricultural;RoW;tractor, 4-wheel, agricultural;;market for zinc;0.012;kilogram;zinc;0.0;technosphere;GLO;ecoinvent_cutoff_3.9_remind_SSP2-Base_2020;zinc
eee13f09d392bf3af198e953c4ccadbc;electric parts production, mini CHP plant;RoW;electric parts, mini CHP plant;;market for zinc;0.04;kilogram;zinc;0.0;technosphere;GLO;ecoinvent_cutoff_3.9_remind_SSP2-Base_2020;zinc
ef18721536e91ca670de2f849576f195;door production, inner, glass-wood;RoW;door, inner, glass-wood;;market for zinc;0.00054;kilogram;zinc;0.0;technosphere;GLO;ecoinvent_cutoff_3.9_remind_SSP2-Base_2020;zinc
efddc804d67a528f30836eb81e5cbcce;photovoltaics, electric installation for 3kWp module, at building;RoW;photovoltaics, electric installation for 3kWp module, at building;;market for zinc;0.04;kilogram;zinc;0.0;technosphere;GLO;ecoinvent_cutoff_3.9_remind_SSP2-Base_2020;zinc
f333e50cbb2cfb46d22c8dfe0f367594;gold mine operation and gold production, unrefined;RoW;gold, unrefined;;market for zinc;2.8946;kilogram;zinc;0.0;technosphere;GLO;ecoinvent_cutoff_3.9_remind_SSP2-Base_2020;zinc
f43361370b3f0e4c8f20c72b6d651fce;window frame production, poly vinyl chloride, U=1.6 W/m2K;RER;window frame, poly vinyl chloride, U=1.6 W/m2K;;market for zinc;0.325;kilogram;zinc;0.0;technosphere;GLO;ecoinvent_cutoff_3.9_remind_SSP2-Base_2020;zinc
f64ea10b36c9b6f772a93f90ca059a14;silver-gold mine operation with refinery;RoW;silver;;market for zinc;0.025186005511794236;kilogram;zinc;0.0;technosphere;GLO;ecoinvent_cutoff_3.9_remind_SSP2-Base_2020;zinc
f8520578545d3fddf3ba28d562a6cd5d;integrated circuit production, logic type;GLO;integrated circuit, logic type;;market for zinc;0.00756;kilogram;zinc;0.0;technosphere;GLO;ecoinvent_cutoff_3.9_remind_SSP2-Base_2020;zinc
f876d623de3323d7873961a88ad43574;primary zinc production from concentrate;RoW;copper cake;;market for zinc;0.004824434504084718;kilogram;zinc;0.0;technosphere;GLO;ecoinvent_cutoff_3.9_remind_SSP2-Base_2020;zinc
f9aedfddfde4336bda343e418ddefe81;primary zinc production from concentrate;RoW;lead;;market for zinc;0.0014781378718494362;kilogram;zinc;0.0;technosphere;GLO;ecoinvent_cutoff_3.9_remind_SSP2-Base_2020;zinc
fa8612965c9d7fba91801fb5fe3c38bc;phthalimide-compound production;RER;phthalimide-compound;;market for zinc;0.0078456;kilogram;zinc;0.0;technosphere;GLO;ecoinvent_cutoff_3.9_remind_SSP2-Base_2020;zinc
fbccb5f9d84e98ecb71427b5c087d888;fuel cell production, solid oxide, 125kW electrical, future;RoW;fuel cell, solid oxide, 125kW electrical, future;;market for zinc;1.25;kilogram;zinc;0.0;technosphere;GLO;ecoinvent_cutoff_3.9_remind_SSP2-Base_2020;zinc
fc7bed555eb72e0c1b570ebbc63bd0bb;window frame production, wood, U=1.5 W/m2K;CA-QC;window frame, wood, U=1.5 W/m2K;;market for zinc;0.2896808250026598;kilogram;zinc;0.0;technosphere;GLO;ecoinvent_cutoff_3.9_remind_SSP2-Base_2020;zinc
fe0caef0e9457269b039bf9b45d96a89;maintenance, solid oxide fuel cell 125kW electrical, future;CH;maintenance, solid oxide fuel cell, 125kW electrical, future;;market for zinc;1.25;kilogram;zinc;0.0;technosphere;GLO;ecoinvent_cutoff_3.9_remind_SSP2-Base_2020;zinc
