code;name;location;reference product;categories;ex_name;ex_amount;ex_unit;ex_product;ex_production volume;ex_type;ex_location;database;material_group
76b7480122cbecd22de2a62e5e03e298;wind turbine construction, 2MW, onshore;GLO;wind turbine, 2MW, onshore;;market for zinc;203.0;kilogram;zinc;0.0;technosphere;GLO;ecoinvent_cutoff_3.9_remind_SSP2-Base_2020;zinc
778233d8a3e8a609f77b2908f1218403;fuel cell production, solid oxide, 125kW electrical, future;CH;fuel cell, solid oxide, 125kW electrical, future;;market for zinc;1.25;kilogram;zinc;0.0;technosphere;GLO;ecoinvent_cutoff_3.9_remind_SSP2-Base_2020;zinc
77df540a6971adbc97a50cb2216acb4c;pesticide production, unspecified;RoW;pesticide, unspecified;;market for zinc;0.0017549;kilogram;zinc;0.0;technosphere;GLO;ecoinvent_cutoff_3.9_remind_SSP2-Base_2020;zinc
77f7e7d18761fe31b0d2772a12879239;primary zinc production from concentrate;RoW;heat, from steam, in chemical industry;;market for zinc;2.862940281053871e-05;kilogram;zinc;0.0;technosphere;GLO;ecoinvent_cutoff_3.9_remind_SSP2-Base_2020;zinc
799e3d3083ef95830b1309a386dae4a9;harvester production;RoW;harvester;;market for zinc;0.013;kilogram;zinc;0.0;technosphere;GLO;ecoinvent_cutoff_3.9_remind_SSP2-Base_2020;zinc
7d255f9c37803616182abf5b72b63f2d;gold-silver mine operation with refinery;RoW;gold;;market for zinc;2.890536142635193;kilogram;zinc;0.0;technosphere;GLO;ecoinvent_cutoff_3.9_remind_SSP2-Base_2020;zinc
7d8f60cd2b971eef99112e138089e4c9;uranium enrichment centrifuge facility construction;RU;uranium enrichment centrifuge facility;;market for zinc;33000.0;kilogram;zinc;0.0;technosphere;GLO;ecoinvent_cutoff_3.9_remind_SSP2-Base_2020;zinc
7e2f728122151192e9b5c6de0bd68eff;gold production;TZ;gold;;market for zinc;2.8946;kilogram;zinc;0.0;technosphere;GLO;ecoinvent_cutoff_3.9_remind_SSP2-Base_2020;zinc
7e67f7928fc76e3a24a4729178000b15;cyclohexanone production;RER;cyclohexanone;;market for zinc;0.00060185;kilogram;zinc;0.0;technosphere;GLO;ecoinvent_cutoff_3.9_remind_SSP2-Base_2020;zinc
7ea3af13020550a1fd2b09f4ed9b3027;petroleum refinery operation;CH;heavy fuel oil;;market for zinc;1.1111236050929171e-07;kilogram;zinc;0.0;technosphere;GLO;ecoinvent_cutoff_3.9_remind_SSP2-Base_2020;zinc
7eaad144c08e24de0e2c1a0822bde079;microwave oven production;GLO;microwave oven;;market for zinc;0.0006;kilogram;zinc;0.0;technosphere;GLO;ecoinvent_cutoff_3.9_remind_SSP2-Base_2020;zinc
7f122fa9dd18470ef454dfd244e743ad;fava bean production;RoW;fava bean;;market for zinc;0.0011838260757766;kilogram;zinc;0.0;technosphere;GLO;ecoinvent_cutoff_3.9_remind_SSP2-Base_2020;zinc
7f2f678d60732dcf84e503054e2ed2e7;nuclear spent fuel reprocessing facility construction;RER;nuclear spent fuel reprocessing facility;;market for zinc;65000.0;kilogram;zinc;0.0;technosphere;GLO;ecoinvent_cutoff_3.9_remind_SSP2-Base_2020;zinc
7ff4f8f92607aa7af58939da0e2696e7;red kidney bean production;RoW;red kidney bean;;market for zinc;0.000241976633480062;kilogram;zinc;0.0;technosphere;GLO;ecoinvent_cutoff_3.9_remind_SSP2-Base_2020;zinc
805fa864d6ef3092ca19e9a09294aa65;gold-silver mine operation and beneficiation;CA-QC;lead concentrate;;market for zinc;0.0015619898241626714;kilogram;zinc;0.0;technosphere;GLO;ecoinvent_cutoff_3.9_remind_SSP2-Base_2020;zinc
808885e76f31082dfaa519928b0fee16;photovoltaics, electric installation for 570kWp module, open ground;GLO;photovoltaics, electric installation for 570kWp module, open ground;;market for zinc;2.7285;kilogram;zinc;0.0;technosphere;GLO;ecoinvent_cutoff_3.9_remind_SSP2-Base_2020;zinc
8094369cebd08e103df286a542772d9a;rare earth oxides production, from rare earth oxide concentrate, 70% REO;CN-SC;europium oxide;;market for zinc;8.664877444831283e-05;kilogram;zinc;0.0;technosphere;GLO;ecoinvent_cutoff_3.9_remind_SSP2-Base_2020;zinc
814ee5af40bc5e139ec55f49c2668c0c;window frame production, poly vinyl chloride, U=1.6 W/m2K;RoW;window frame, poly vinyl chloride, U=1.6 W/m2K;;market for zinc;0.325;kilogram;zinc;0.0;technosphere;GLO;ecoinvent_cutoff_3.9_remind_SSP2-Base_2020;zinc
84aed9da6297c8bf1c8353b7a66122e1;battery production, NiMH, rechargeable, prismatic;GLO;battery, NiMH, rechargeable, prismatic;;market for zinc;3.6223e-08;kilogram;zinc;0.0;technosphere;GLO;ecoinvent_cutoff_3.9_remind_SSP2-Base_2020;zinc
84d36a319a2b5af528e3f37d7af5a1fe;zinc coating, coils;RoW;zinc coat, coils;;market for zinc;0.679;kilogram;zinc;0.0;technosphere;GLO;ecoinvent_cutoff_3.9_remind_SSP2-Base_2020;zinc
86156d2c70aef7176e380735fb59009f;cookstove production, gas or electric;GLO;cookstove;;market for zinc;0.2;kilogram;zinc;0.0;technosphere;GLO;ecoinvent_cutoff_3.9_remind_SSP2-Base_2020;zinc
883b45be5d99e412f1a2e4744c1462e9;gold-silver mine operation with refinery;PG;gold;;market for zinc;2.8570600542572637;kilogram;zinc;0.0;technosphere;GLO;ecoinvent_cutoff_3.9_remind_SSP2-Base_2020;zinc
88c77cd46746a1b8f5d242d544df9055;ceramic tile production;RoW;ceramic tile;;market for zinc;0.00339;kilogram;zinc;0.0;technosphere;GLO;ecoinvent_cutoff_3.9_remind_SSP2-Base_2020;zinc
8c0a62935bb20badf656f6c54d2118d9;gold mine operation and refining;SE;gold;;market for zinc;0.6716377811146365;kilogram;zinc;0.0;technosphere;GLO;ecoinvent_cutoff_3.9_remind_SSP2-Base_2020;zinc
8d1dfedcfe91ab85852d91e964f7d849;rare earth oxides production, from rare earth oxide concentrate, 70% REO;CN-SC;iron ore concentrate;;market for zinc;1.164653259331106e-05;kilogram;zinc;0.0;technosphere;GLO;ecoinvent_cutoff_3.9_remind_SSP2-Base_2020;zinc
8d219eca0a4a98126ad38ea18f2db579;aluminium alloy production, AlMg3;RoW;aluminium alloy, AlMg3;;market for zinc;0.00203;kilogram;zinc;0.0;technosphere;GLO;ecoinvent_cutoff_3.9_remind_SSP2-Base_2020;zinc
8ebdcddc3b459d733b720f7fe6c403b7;primary zinc production from concentrate;RoW;cobalt;;market for zinc;0.05268218110100019;kilogram;zinc;0.0;technosphere;GLO;ecoinvent_cutoff_3.9_remind_SSP2-Base_2020;zinc
8f9e0579041ee7d7218eb99a63c86063;gold mine operation and gold production, unrefined;ZA;gold, unrefined;;market for zinc;2.8946;kilogram;zinc;0.0;technosphere;GLO;ecoinvent_cutoff_3.9_remind_SSP2-Base_2020;zinc
91411727c0d89d56394d80d5b50c2a8f;pinto bean production;RoW;pinto bean;;market for zinc;0.0118655520823598;kilogram;zinc;0.0;technosphere;GLO;ecoinvent_cutoff_3.9_remind_SSP2-Base_2020;zinc
9349d4b9233dfc30da8da222463612f3;ethanol fermentation plant construction;CH;ethanol fermentation plant;;market for zinc;86000.0;kilogram;zinc;0.0;technosphere;GLO;ecoinvent_cutoff_3.9_remind_SSP2-Base_2020;zinc
93f540de58b9d86456755cdd1e7150ef;almond production;CN;almond;;market for zinc;0.00201014121431;kilogram;zinc;0.0;technosphere;GLO;ecoinvent_cutoff_3.9_remind_SSP2-Base_2020;zinc
965d8bd44fedfb903bdb753b143579ed;chassis production, internet access equipment;RER;chassis, internet access equipment;;market for zinc;0.001;kilogram;zinc;0.0;technosphere;GLO;ecoinvent_cutoff_3.9_remind_SSP2-Base_2020;zinc
97f948fcdb27060e52de337c46879b8e;power adapter production, for smartphone;GLO;power adapter, for smartphone;;market for zinc;0.0012;kilogram;zinc;0.0;technosphere;GLO;ecoinvent_cutoff_3.9_remind_SSP2-Base_2020;zinc
983f25cf60448f648c7eeb606944a629;power block installation, solar tower power plant, 20 MW;RoW;power block, solar tower power plant, 20 MW;;market for zinc;825.0;kilogram;zinc;0.0;technosphere;GLO;ecoinvent_cutoff_3.9_remind_SSP2-Base_2020;zinc
99878f38a5748825cc0df72fce3f7cbd;rare earth oxides production, from rare earth oxide concentrate, 70% REO;CN-SC;sodium chloride, powder;;market for zinc;1.9538054740005428e-05;kilogram;zinc;0.0;technosphere;GLO;ecoinvent_cutoff_3.9_remind_SSP2-Base_2020;zinc
9a6e80195aa0fbc7e69c76da8148b4de;wind turbine construction, 750kW, onshore;CA-QC;wind turbine, 750kW, onshore;;market for zinc;203.0;kilogram;zinc;0.0;technosphere;GLO;ecoinvent_cutoff_3.9_remind_SSP2-Base_2020;zinc
9b64f7eae91b97d7bf607e6aaf893cc1;mancozeb production;RoW;mancozeb;;market for zinc;0.13337;kilogram;zinc;0.0;technosphere;GLO;ecoinvent_cutoff_3.9_remind_SSP2-Base_2020;zinc
9d848e5a5267818544c92dc653ee6e8e;petroleum refinery operation;CH;kerosene;;market for zinc;7.376867974045545e-08;kilogram;zinc;0.0;technosphere;GLO;ecoinvent_cutoff_3.9_remind_SSP2-Base_2020;zinc
9e23ac7184b57244ac86bc81efb5a9ea;seed-cotton production, conventional;BD;seed-cotton;;market for zinc;0.0037112;kilogram;zinc;0.0;technosphere;GLO;ecoinvent_cutoff_3.9_remind_SSP2-Base_2020;zinc
9e39ca79ca9d4e769e1f81226e45b37e;electric installation, 450 kWp photovoltaic plant, at plant;DE;electric installation, 450 kWp photovoltaic plant, at plant;;market for zinc;2.7285;kilogram;zinc;;technosphere;GLO;ecoinvent_cutoff_3.9_remind_SSP2-Base_2020;zinc
9edfe11b13eb77bbec25bf6cedd4fa66;brass production;CH;brass;;market for zinc;0.303;kilogram;zinc;0.0;technosphere;GLO;ecoinvent_cutoff_3.9_remind_SSP2-Base_2020;zinc
9f01dc83b31c815ff554fe7189874241;magnesium-alloy production, AZ91;RoW;magnesium-alloy, AZ91;;market for zinc;0.00711;kilogram;zinc;0.0;technosphere;GLO;ecoinvent_cutoff_3.9_remind_SSP2-Base_2020;zinc
9f5c2cc5f317d90a1fa0ea883ed163c0;silver-gold mine operation with refinery;RoW;gold;;market for zinc;1.9511931045749311;kilogram;zinc;0.0;technosphere;GLO;ecoinvent_cutoff_3.9_remind_SSP2-Base_2020;zinc
9f86d0595cbfb3e0a9c34c9d57f81c6e;almond production;US;almond;;market for zinc;0.00175570033405;kilogram;zinc;0.0;technosphere;GLO;ecoinvent_cutoff_3.9_remind_SSP2-Base_2020;zinc
a2e01943aaf5ec1539000a433185a92e;wind turbine construction, 750kW, onshore;RoW;wind turbine, 750kW, onshore;;market for zinc;203.0;kilogram;zinc;0.0;technosphere;GLO;ecoinvent_cutoff_3.9_remind_SSP2-Base_2020;zinc
a344462f42ad9bfd317059c6a3e0e51f;primary zinc production from concentrate;RoW;ammonium sulfate;;market for zinc;0.0007549628915360023;kilogram;zinc;0.0;technosphere;GLO;ecoinvent_cutoff_3.9_remind_SSP2-Base_2020;zinc
a4048166c7d52473e19d4db393d1ee93;ferry production;GLO;ferry;;market for zinc;25365.19544;kilogram;zinc;0.0;technosphere;GLO;ecoinvent_cutoff_3.9_remind_SSP2-Base_2020;zinc
a5326811417e1c3fd0459dfb7446fb4e;door production, inner, wood;RoW;door, inner, wood;;market for zinc;0.00054;kilogram;zinc;0.0;technosphere;GLO;ecoinvent_cutoff_3.9_remind_SSP2-Base_2020;zinc
a955a92e4e0948d0830616075f16d6f3;open ground construction, on ground, Mont Soleil;CH;open ground construction, on ground, Mont Soleil;;market for zinc;2.6224;kilogram;zinc;;technosphere;GLO;ecoinvent_cutoff_3.9_remind_SSP2-Base_2020;zinc
aa5fd4c3c9e076ac4e2876c4fc3badd2;transmission network construction, electricity, high voltage direct current aerial line;RoW;transmission network, electricity, high voltage direct current aerial line;;market for zinc;520.0;kilogram;zinc;0.0;technosphere;GLO;ecoinvent_cutoff_3.9_remind_SSP2-Base_2020;zinc
aa89528570a217d1648075dc6605646b;protein pea production;CA-AB;protein pea;;market for zinc;1.53852e-07;kilogram;zinc;0.0;technosphere;GLO;ecoinvent_cutoff_3.9_remind_SSP2-Base_2020;zinc
ab296d480b759da0ceae7cd31421e499;biomethane production, high pressure from synthetic gas, wood, fixed bed technology;RoW;biomethane, high pressure;;market for zinc;0.0018694;kilogram;zinc;0.0;technosphere;GLO;ecoinvent_cutoff_3.9_remind_SSP2-Base_2020;zinc
ac93c28e925a7b39cc05e71c24060277;maintenance, solid oxide fuel cell 125kW electrical, future;RoW;maintenance, solid oxide fuel cell, 125kW electrical, future;;market for zinc;1.25;kilogram;zinc;0.0;technosphere;GLO;ecoinvent_cutoff_3.9_remind_SSP2-Base_2020;zinc
ace62218113bd7acc90b4f255cca6b24;1,1-difluoroethane production, HFC-152a;RoW;1,1-difluoroethane, HFC-152a;;market for zinc;0.0019676;kilogram;zinc;0.0;technosphere;GLO;ecoinvent_cutoff_3.9_remind_SSP2-Base_2020;zinc
ace8a8b1af868a2bbbd41948343c8139;rare earth oxides production, from rare earth oxide concentrate, 70% REO;CN-SC;lanthanum oxide;;market for zinc;0.0008770752542991172;kilogram;zinc;0.0;technosphere;GLO;ecoinvent_cutoff_3.9_remind_SSP2-Base_2020;zinc
ae60fb191aa7da053b24b4ca3db9dae9;tanker production, for liquefied natural gas;GLO;tanker, for liquefied natural gas;;market for zinc;54487.16895;kilogram;zinc;0.0;technosphere;GLO;ecoinvent_cutoff_3.9_remind_SSP2-Base_2020;zinc
af57a33bfb4349e294ad00dfa4f7b99d;liquid manure tank trailer production;RoW;liquid manure tank trailer;;market for zinc;0.024;kilogram;zinc;0.0;technosphere;GLO;ecoinvent_cutoff_3.9_remind_SSP2-Base_2020;zinc
b0d70c147eb7c978befe9a68571bcf7d;gold-silver mine operation and beneficiation;CA-QC;copper concentrate, sulfide ore;;market for zinc;0.0034903839241460324;kilogram;zinc;0.0;technosphere;GLO;ecoinvent_cutoff_3.9_remind_SSP2-Base_2020;zinc
b29cec13dfb78315ff9a9ac9c29218f9;zinc coating, pieces, adjustment per micro-m;RoW;zinc coat, pieces, adjustment per micro-m;;market for zinc;0.0154;kilogram;zinc;0.0;technosphere;GLO;ecoinvent_cutoff_3.9_remind_SSP2-Base_2020;zinc
b2d2dc5f727f613a42c88ef8e23a80c8;titanium zinc plate production, without pre-weathering;RoW;titanium zinc plate, without pre-weathering;;market for zinc;1.06;kilogram;zinc;0.0;technosphere;GLO;ecoinvent_cutoff_3.9_remind_SSP2-Base_2020;zinc
b32fbcf2c7785b8e7c5e4532309790a5;brass production;RoW;brass;;market for zinc;0.303;kilogram;zinc;0.0;technosphere;GLO;ecoinvent_cutoff_3.9_remind_SSP2-Base_2020;zinc
b42642b41f907c4b302fe026ca81f405;petroleum refinery operation;CH;petrol, unleaded;;market for zinc;2.2625065691655982e-07;kilogram;zinc;0.0;technosphere;GLO;ecoinvent_cutoff_3.9_remind_SSP2-Base_2020;zinc
b448e40c35a243fcb4b496ea9af86764;transmission pipeline for hydrogen, dedicated hydrogen pipeline;RER;pipeline, for hydrogen transmission;;market for zinc;51.1;kilogram;zinc;;technosphere;GLO;ecoinvent_cutoff_3.9_remind_SSP2-Base_2020;zinc
b4df393a8513410c47bece5dce94f0cc;almond production;RoW;almond;;market for zinc;0.00176199171387;kilogram;zinc;0.0;technosphere;GLO;ecoinvent_cutoff_3.9_remind_SSP2-Base_2020;zinc
b4ffb218d372a744662be755203ccfa6;silver-gold mine operation with refinery;CL;silver;;market for zinc;0.02518600551179424;kilogram;zinc;0.0;technosphere;GLO;ecoinvent_cutoff_3.9_remind_SSP2-Base_2020;zinc
b79719b135837cd7c0cc462514506808;rare earth oxides production, from rare earth oxide concentrate, 70% REO;CN-SC;calcium carbonate, precipitated;;market for zinc;0.00011272446963975586;kilogram;zinc;0.0;technosphere;GLO;ecoinvent_cutoff_3.9_remind_SSP2-Base_2020;zinc
ba6b7f905075f479591950d35fb09235;transmission network construction, electricity, high voltage direct current aerial line;RER;transmission network, electricity, high voltage direct current aerial line;;market for zinc;520.0;kilogram;zinc;0.0;technosphere;GLO;ecoinvent_cutoff_3.9_remind_SSP2-Base_2020;zinc
ba86478dc23b219cebe6879d985bbf99;pinto bean production;CA-MB;pinto bean;;market for zinc;0.0152;kilogram;zinc;0.0;technosphere;GLO;ecoinvent_cutoff_3.9_remind_SSP2-Base_2020;zinc
bbc1da3206db48b2346c5a80ea9699d6;treatment of aluminium scrap, new, at refiner;RER;aluminium oxide, non-metallurgical;;market for zinc;0.011223378821739339;kilogram;zinc;0.0;technosphere;GLO;ecoinvent_cutoff_3.9_remind_SSP2-Base_2020;zinc
bc1db2dd9a1834fff992fadcfa778426;railway track construction;RoW;railway track;;market for zinc;0.006;kilogram;zinc;0.0;technosphere;GLO;ecoinvent_cutoff_3.9_remind_SSP2-Base_2020;zinc
bc912340fd00d1ed89f7033bd3c91d37;nuclear spent fuel reprocessing facility construction;RoW;nuclear spent fuel reprocessing facility;;market for zinc;65000.0;kilogram;zinc;0.0;technosphere;GLO;ecoinvent_cutoff_3.9_remind_SSP2-Base_2020;zinc
bdfb895d364294cb4102c0ad3695a1df;treatment of aluminium scrap, new, at refiner;RoW;aluminium oxide, non-metallurgical;;market for zinc;0.011223378821739339;kilogram;zinc;0.0;technosphere;GLO;ecoinvent_cutoff_3.9_remind_SSP2-Base_2020;zinc
bfd7d38148ab9922ddffd2db8be9f177;1,1-difluoroethane production, HFC-152a;US;1,1-difluoroethane, HFC-152a;;market for zinc;0.0019676;kilogram;zinc;0.0;technosphere;GLO;ecoinvent_cutoff_3.9_remind_SSP2-Base_2020;zinc
c02ec52e29966b1a3541440bb3f94886;stirling heat and power co-generation unit construction, 3kW electrical, wood pellet, future;CH;stirling heat and power co-generation unit, 3kW electrical, wood pellet, future;;market for zinc;0.04;kilogram;zinc;0.0;technosphere;GLO;ecoinvent_cutoff_3.9_remind_SSP2-Base_2020;zinc
c06580bea2910e0651c8e3a370506956;treatment of aluminium scrap, post-consumer, prepared for recycling, at refiner;RoW;aluminium, cast alloy;;market for zinc;0.052108544529504065;kilogram;zinc;0.0;technosphere;GLO;ecoinvent_cutoff_3.9_remind_SSP2-Base_2020;zinc
c1a40682e32d24f5694d3118a847b14a;zinc coating, coils;RER;zinc coat, coils;;market for zinc;0.679;kilogram;zinc;0.0;technosphere;GLO;ecoinvent_cutoff_3.9_remind_SSP2-Base_2020;zinc
c242d04c68708b27ffc01fc8cdd502ca;photovoltaic laminate production, CIS;RoW;photovoltaic laminate, CIS;;market for zinc;0.012077;kilogram;zinc;0.0;technosphere;GLO;ecoinvent_cutoff_3.9_remind_SSP2-Base_2020;zinc
c287cf8d42e7e163042e1b3ffab42267;uranium enrichment centrifuge facility construction;CN;uranium enrichment centrifuge facility;;market for zinc;33000.0;kilogram;zinc;0.0;technosphere;GLO;ecoinvent_cutoff_3.9_remind_SSP2-Base_2020;zinc
c28fea90ce64b01bee44487232ad77bf;primary zinc production from concentrate;RoW;zinc;;market for zinc;0.002066214229466954;kilogram;zinc;0.0;technosphere;GLO;ecoinvent_cutoff_3.9_remind_SSP2-Base_2020;zinc
c2c8582f020643e6896ab7676bf5db38;cabin, for lorry;RER;cabin, for lorry;;market for zinc;0.000285;kilogram;zinc;;technosphere;GLO;ecoinvent_cutoff_3.9_remind_SSP2-Base_2020;zinc
c30a81fb730041b7ae3182c61f767c43;electric installation, 324 kWp photovoltaic plant, at plant;DE;electric installation, 324 kWp photovoltaic plant, at plant;;market for zinc;2.7285;kilogram;zinc;;technosphere;GLO;ecoinvent_cutoff_3.9_remind_SSP2-Base_2020;zinc
c3439558f54fd00832a7e6663d02993b;control cabinet production, heat and power co-generation unit, 160kW electrical;RER;control cabinet, heat and power co-generation unit, 160kW electrical;;market for zinc;0.25;kilogram;zinc;0.0;technosphere;GLO;ecoinvent_cutoff_3.9_remind_SSP2-Base_2020;zinc
c449c46302365596344f3804e3d95d1d;lentil production;RoW;lentil;;market for zinc;4.88375e-05;kilogram;zinc;0.0;technosphere;GLO;ecoinvent_cutoff_3.9_remind_SSP2-Base_2020;zinc
c5c4fb1410cae3277ced20101dcfeda0;control cabinet production, heat and power co-generation unit, 160kW electrical;RoW;control cabinet, heat and power co-generation unit, 160kW electrical;;market for zinc;0.25;kilogram;zinc;0.0;technosphere;GLO;ecoinvent_cutoff_3.9_remind_SSP2-Base_2020;zinc
c6338e3e7b7f424b7580de49cf81937f;electronic component production, passive, mobile, earpiece and speaker;GLO;electronic component, passive, mobile, earpiece and speaker;;market for zinc;0.134623840362182;kilogram;zinc;0.0;technosphere;GLO;ecoinvent_cutoff_3.9_remind_SSP2-Base_2020;zinc
c88a0d427ea072b0228c8e459f7dab34;railway track construction;CH;railway track;;market for zinc;0.006;kilogram;zinc;0.0;technosphere;GLO;ecoinvent_cutoff_3.9_remind_SSP2-Base_2020;zinc
cd5c729d6e512168a442384ffce130dd;rare earth oxides production, from rare earth oxide concentrate, 70% REO;CN-SC;coal tar;;market for zinc;4.888052223316848e-05;kilogram;zinc;0.0;technosphere;GLO;ecoinvent_cutoff_3.9_remind_SSP2-Base_2020;zinc
ce2b7bac9fbc144a8f1ecb742b19ff03;petroleum refinery operation;CH;liquefied petroleum gas;;market for zinc;1.3660846053084656e-07;kilogram;zinc;0.0;technosphere;GLO;ecoinvent_cutoff_3.9_remind_SSP2-Base_2020;zinc
ce2d2aeb3e07aa4006b130d2895fc332;stirling heat and power co-generation unit construction, 3kW electrical, wood pellet, future;RoW;stirling heat and power co-generation unit, 3kW electrical, wood pellet, future;;market for zinc;0.04;kilogram;zinc;0.0;technosphere;GLO;ecoinvent_cutoff_3.9_remind_SSP2-Base_2020;zinc
ce9d3f1079011c9547a64c8d3c76adc7;primary zinc production from concentrate;RoW;sulfuric acid;;market for zinc;0.00012516490043886356;kilogram;zinc;0.0;technosphere;GLO;ecoinvent_cutoff_3.9_remind_SSP2-Base_2020;zinc
cece674fdd365a989fe3f9f74ca8a079;rare earth oxides production, from rare earth oxide concentrate, 70% REO;CN-SC;cerium oxide;;market for zinc;0.000767892815613033;kilogram;zinc;0.0;technosphere;GLO;ecoinvent_cutoff_3.9_remind_SSP2-Base_2020;zinc
cff6b310b4d72657cb3dc4c02f951829;primary zinc production from concentrate;RoW;silver;;market for zinc;0.6444151194286282;kilogram;zinc;0.0;technosphere;GLO;ecoinvent_cutoff_3.9_remind_SSP2-Base_2020;zinc
d00c81cfcd1fa4cc1706e5e73b2ad266;door production, inner, wood;RER;door, inner, wood;;market for zinc;0.00054;kilogram;zinc;0.0;technosphere;GLO;ecoinvent_cutoff_3.9_remind_SSP2-Base_2020;zinc
d13d9b122847bb6e559b9bebf098f17a;silver-gold mine operation with refinery;CL;gold;;market for zinc;1.9511931045749313;kilogram;zinc;0.0;technosphere;GLO;ecoinvent_cutoff_3.9_remind_SSP2-Base_2020;zinc
d20b3593abff7ca546b9a19d6d301553;treatment of aluminium scrap, post-consumer, prepared for recycling, at refiner;RER;aluminium oxide, non-metallurgical;;market for zinc;0.011223378821739339;kilogram;zinc;0.0;technosphere;GLO;ecoinvent_cutoff_3.9_remind_SSP2-Base_2020;zinc
d452a083f085c449ca46d9726484f6bf;transistor production, wired, small size, through-hole mounting;GLO;transistor, wired, small size, through-hole mounting;;market for zinc;0.01334;kilogram;zinc;0.0;technosphere;GLO;ecoinvent_cutoff_3.9_remind_SSP2-Base_2020;zinc
d4bdb967cd4aa30d49967455954f2d89;window frame production, wood, U=1.5 W/m2K;CA-QC;wood pellet, measured as dry mass;;market for zinc;0.00011059424717262562;kilogram;zinc;0.0;technosphere;GLO;ecoinvent_cutoff_3.9_remind_SSP2-Base_2020;zinc
d5f1324f95344f5ea0ceebb140fc0836;electric installation, 570 kWp photovoltaic plant, at plant;ES;electric installation, 570 kWp photovoltaic plant, at plant;;market for zinc;2.7285;kilogram;zinc;;technosphere;GLO;ecoinvent_cutoff_3.9_remind_SSP2-Base_2020;zinc
d7066927c80b04a3cac74d3fa425cebd;dithiocarbamate-compound production;RER;dithiocarbamate-compound;;market for zinc;0.13337;kilogram;zinc;0.0;technosphere;GLO;ecoinvent_cutoff_3.9_remind_SSP2-Base_2020;zinc
d7887c75c3e4127548a9caf0f4bac50a;primary zinc production from concentrate;RoW;gold;;market for zinc;49.92369023838093;kilogram;zinc;0.0;technosphere;GLO;ecoinvent_cutoff_3.9_remind_SSP2-Base_2020;zinc
d7d8a3ba8c2f8e187909780f3a25517a;biomethane production, high pressure from synthetic gas, wood, fluidised technology;RoW;biomethane, high pressure;;market for zinc;0.0018694;kilogram;zinc;0.0;technosphere;GLO;ecoinvent_cutoff_3.9_remind_SSP2-Base_2020;zinc
d82453d9c3d0740d26e7f83eb7bfd671;primary zinc production from concentrate;RoW;zinc monosulfate;;market for zinc;0.0009357566366143608;kilogram;zinc;0.0;technosphere;GLO;ecoinvent_cutoff_3.9_remind_SSP2-Base_2020;zinc
d83dc7811d0d9c90d2539da3d6e959c8;photovoltaics, electric installation for 3kWp module, at building;CH;photovoltaics, electric installation for 3kWp module, at building;;market for zinc;0.04;kilogram;zinc;0.0;technosphere;GLO;ecoinvent_cutoff_3.9_remind_SSP2-Base_2020;zinc
d83ed56ab9fbf680709cd635aaf0e0ba;purse seiner construction, wood;RoW;purse seiner, wood;;market for zinc;0.0002999190218640967;kilogram;zinc;0.0;technosphere;GLO;ecoinvent_cutoff_3.9_remind_SSP2-Base_2020;zinc
d871c79dccb7efd9023e9f73485d5e77;photovoltaic laminate production, CIS;DE;photovoltaic laminate, CIS;;market for zinc;0.012077;kilogram;zinc;0.0;technosphere;GLO;ecoinvent_cutoff_3.9_remind_SSP2-Base_2020;zinc
db2016518ff38f66a46036d8808ae402;cyclohexanone production;RoW;cyclohexanone;;market for zinc;0.00060185;kilogram;zinc;0.0;technosphere;GLO;ecoinvent_cutoff_3.9_remind_SSP2-Base_2020;zinc
db5daa0887d6fba05137cc284031ff42;pinto bean production;CA-AB;pinto bean;;market for zinc;0.0003;kilogram;zinc;0.0;technosphere;GLO;ecoinvent_cutoff_3.9_remind_SSP2-Base_2020;zinc
dca61a8baf554e0ce48a4427327937a4;gold mine operation and refining;SE;lead;;market for zinc;1.9885814443805474e-05;kilogram;zinc;0.0;technosphere;GLO;ecoinvent_cutoff_3.9_remind_SSP2-Base_2020;zinc
dcf7f57b71d3942e163bf459dd4535ce;petroleum refinery operation;CH;diesel;;market for zinc;4.2468333307328095e-08;kilogram;zinc;0.0;technosphere;GLO;ecoinvent_cutoff_3.9_remind_SSP2-Base_2020;zinc
dd98a31f32a46ea05f37f7fd60a68559;silver mine operation with extraction;PE;zinc concentrate;;market for zinc;0.0014357200550992816;kilogram;zinc;0.0;technosphere;GLO;ecoinvent_cutoff_3.9_remind_SSP2-Base_2020;zinc
ddd736f0e0a3ca30cc0f8ee3aa26d55b;window frame production, wood, U=1.5 W/m2K;RER;wood pellet, measured as dry mass;;market for zinc;0.00011059424717262562;kilogram;zinc;0.0;technosphere;GLO;ecoinvent_cutoff_3.9_remind_SSP2-Base_2020;zinc
ddf94fec0b56081e026d4078de7f19cb;zinc coating, pieces, adjustment per micro-m;RER;zinc coat, pieces, adjustment per micro-m;;market for zinc;0.0154;kilogram;zinc;0.0;technosphere;GLO;ecoinvent_cutoff_3.9_remind_SSP2-Base_2020;zinc
de15a29dd991709d2072746137c87164;treatment of sulfidic tailing, off-site, high gold content;ZA;gold, unrefined;;market for zinc;2.8946;kilogram;zinc;0.0;technosphere;GLO;ecoinvent_cutoff_3.9_remind_SSP2-Base_2020;zinc
df9e587db94a789d3ba3963d36bbf4e2;rare earth oxides production, from rare earth oxide concentrate, 70% REO;CN-SC;praseodymium-neodymium oxide;;market for zinc;0.0009327178369230367;kilogram;zinc;0.0;technosphere;GLO;ecoinvent_cutoff_3.9_remind_SSP2-Base_2020;zinc
dfa0f30ea53a105cbfa6661bfe0d2bd5;rare earth oxides production, from rare earth oxide concentrate, 70% REO;CN-SC;sulfur;;market for zinc;1.3760803211959816e-05;kilogram;zinc;0.0;technosphere;GLO;ecoinvent_cutoff_3.9_remind_SSP2-Base_2020;zinc
e01ba5fef019aba2b0d44ac19d839f2a;biomethane production, high pressure from synthetic gas, wood, fixed bed technology;CH;biomethane, high pressure;;market for zinc;0.0018694;kilogram;zinc;0.0;technosphere;GLO;ecoinvent_cutoff_3.9_remind_SSP2-Base_2020;zinc
