code;name;location;reference product;categories;ex_name;ex_amount;ex_unit;ex_product;ex_production volume;ex_type;ex_location;database;material_group
7911eadc945b3209644f7ddb2d80255f;treatment of municipal solid waste, incineration;TR;municipal solid waste;;market for cement, unspecified;0.008896;kilogram;cement, unspecified;;technosphere;MEA;ecoinvent_cutoff_3.9_remind_SSP1-Base_2025;cement
79673e39456fb26f4665f9ed807e9b3a;treatment of waste expanded polystyrene, municipal incineration;CH;waste expanded polystyrene;;market for cement, unspecified;0.00487;kilogram;cement, unspecified;;technosphere;NEU;ecoinvent_cutoff_3.9_remind_SSP1-Base_2025;cement
79b2054dcd97497eab3477c74c310fc9;cement production, CP II-Z;CHA;cement, CP II-Z;;market for cement factory;2.73e-11;unit;cement factory;;technosphere;GLO;ecoinvent_cutoff_3.9_remind_SSP1-Base_2025;cement
79b32169d5314dcdb621d55fe43acb7c;cement production, type IP/P;EUR;cement, type IP/P;;market for cement factory;5.36e-11;unit;cement factory;;technosphere;GLO;ecoinvent_cutoff_3.9_remind_SSP1-Base_2025;cement
79f42b6647374938b3d3783e32550554;electricity production, Evolutionary Power Reactor (EPR);RER;electricity, high voltage;;market for cement, Portland;8.55e-07;kilogram;cement, Portland;;technosphere;EUR;ecoinvent_cutoff_3.9_remind_SSP1-Base_2025;cement
7a42269d25855f1044b4b2963b493d74;treatment of waste plastic, consumer electronics, municipal incineration with fly ash extraction;CH;waste plastic, consumer electronics;;market for cement, unspecified;0.0048592;kilogram;cement, unspecified;;technosphere;NEU;ecoinvent_cutoff_3.9_remind_SSP1-Base_2025;cement
7ae0c3b1d6145c9e4eff219c680d0bb6;uranium fuel element production, enriched 3.8%, for light water reactor;US;uranium, enriched 3.8%, in fuel element for light water reactor;;market for cement, unspecified;0.0065;kilogram;cement, unspecified;;technosphere;USA;ecoinvent_cutoff_3.9_remind_SSP1-Base_2025;cement
7b328c7288eb454592d62cc012c0b664;cement production, type I-PM;NEU;cement, type I-PM;;market for cement factory;5.36e-11;unit;cement factory;;technosphere;GLO;ecoinvent_cutoff_3.9_remind_SSP1-Base_2025;cement
7b39605a1d1f4d808db8b257503977ed;cement production, CEM V/A;IND;cement, CEM V/A;;market for cement factory;5.36e-11;unit;cement factory;;technosphere;GLO;ecoinvent_cutoff_3.9_remind_SSP1-Base_2025;cement
7b8a01ce934b65903bb297c55bc3dc86;treatment of waste paint, hazardous waste incineration;CH;waste paint;;market for cement, unspecified;0.011831;kilogram;cement, unspecified;;technosphere;NEU;ecoinvent_cutoff_3.9_remind_SSP1-Base_2025;cement
7bd11f922f7f46159f0e624d672c9377;cement production, Portland Slag;SSA;cement, Portland Slag;;market for cement factory;5.36e-11;unit;cement factory;;technosphere;GLO;ecoinvent_cutoff_3.9_remind_SSP1-Base_2025;cement
7be0ac2811f2da042bd7055f32fabda2;treatment of residues, MSWI[F]-WWT, WW from PV cell production, residual material landfill;CH;residues, MSWI[F]-WWT, WW from PV cell production;;market for cement, unspecified;0.4;kilogram;cement, unspecified;;technosphere;NEU;ecoinvent_cutoff_3.9_remind_SSP1-Base_2025;cement
7bfb78ca3f046ff461f7c3ddee284a71;treatment of digester sludge, municipal incineration, future;CH;heat, future;;market for cement, unspecified;0.00645993646255857;kilogram;cement, unspecified;;technosphere;NEU;ecoinvent_cutoff_3.9_remind_SSP1-Base_2025;cement
7c0f583aa0ba466280d433e42229fc75;cement production, type S;NEU;cement, type S;;market for cement factory;5.36e-11;unit;cement factory;;technosphere;GLO;ecoinvent_cutoff_3.9_remind_SSP1-Base_2025;cement
7c19873429dcb7ba1f94a65f55bd83e1;treatment of waste polystyrene, municipal incineration with fly ash extraction;CH;waste polystyrene;;market for cement, unspecified;0.0018434;kilogram;cement, unspecified;;technosphere;NEU;ecoinvent_cutoff_3.9_remind_SSP1-Base_2025;cement
7c4deb39aaaa2af246d6c1320ff61e70;treatment of residues, MSWI-WWT, WW from particle board production, residual material landfill;RER;residues, MSWI-WWT, WW from particle board production;;market for cement, unspecified;0.4;kilogram;cement, unspecified;;technosphere;EUR;ecoinvent_cutoff_3.9_remind_SSP1-Base_2025;cement
7c5d91babe2f4c47a326334060f319a5;cement production, CEM II/B-V;NEU;cement, CEM II/B-V;;market for cement factory;5.36e-11;unit;cement factory;;technosphere;GLO;ecoinvent_cutoff_3.9_remind_SSP1-Base_2025;cement
7c8faaea423498c100fca4b8d531d2aa;treatment of green liquor dregs, residual material landfill;CH;green liquor dregs;;market for cement, unspecified;0.4;kilogram;cement, unspecified;;technosphere;NEU;ecoinvent_cutoff_3.9_remind_SSP1-Base_2025;cement
7ca17250213858e32116039ddb27bc35;treatment of filter dust from Al electrolysis, residual material landfill;CH;filter dust from Al electrolysis;;market for cement, unspecified;0.39988;kilogram;cement, unspecified;;technosphere;NEU;ecoinvent_cutoff_3.9_remind_SSP1-Base_2025;cement
7caefe2b2e9845d3a00bc371eb40b49d;cement production, CP II-E;CHA;cement, CP II-E;;market for cement factory;2.73e-11;unit;cement factory;;technosphere;GLO;ecoinvent_cutoff_3.9_remind_SSP1-Base_2025;cement
7cd6f988fed843f490dffdc310cbe036;cement production, ART;JPN;cement, ART;;market for cement factory;5.36e-11;unit;cement factory;;technosphere;GLO;ecoinvent_cutoff_3.9_remind_SSP1-Base_2025;cement
7dd4a18709a2c97e9f7aaaba080afb77;treatment of residues, MSWI[F]-WWT, WW from concrete production, residual material landfill;CH;residues, MSWI[F]-WWT, WW from concrete production;;market for cement, unspecified;0.4;kilogram;cement, unspecified;;technosphere;NEU;ecoinvent_cutoff_3.9_remind_SSP1-Base_2025;cement
7ea0dbb32edc400ff958c2d20d01f801;treatment of average incineration residue, residual material landfill;RoW;average incineration residue;;market for cement, unspecified;0.4000000000000001;kilogram;cement, unspecified;;technosphere;World;ecoinvent_cutoff_3.9_remind_SSP1-Base_2025;cement
7eba4555668563087546d146e049957d;market for cement, unspecified;RoW;cement, unspecified;;market for cement, unspecified;0.005258403890252714;kilogram;cement, unspecified;;technosphere;CAZ;ecoinvent_cutoff_3.9_remind_SSP1-Base_2025;cement
7eba4555668563087546d146e049957d;market for cement, unspecified;RoW;cement, unspecified;;market for cement, unspecified;0.5661374923826646;kilogram;cement, unspecified;;technosphere;CHA;ecoinvent_cutoff_3.9_remind_SSP1-Base_2025;cement
7eba4555668563087546d146e049957d;market for cement, unspecified;RoW;cement, unspecified;;market for cement, unspecified;0.03724665442408569;kilogram;cement, unspecified;;technosphere;EUR;ecoinvent_cutoff_3.9_remind_SSP1-Base_2025;cement
7eba4555668563087546d146e049957d;market for cement, unspecified;RoW;cement, unspecified;;market for cement, unspecified;0.08110087960988153;kilogram;cement, unspecified;;technosphere;IND;ecoinvent_cutoff_3.9_remind_SSP1-Base_2025;cement
7eba4555668563087546d146e049957d;market for cement, unspecified;RoW;cement, unspecified;;market for cement, unspecified;0.011460888332934254;kilogram;cement, unspecified;;technosphere;JPN;ecoinvent_cutoff_3.9_remind_SSP1-Base_2025;cement
7eba4555668563087546d146e049957d;market for cement, unspecified;RoW;cement, unspecified;;market for cement, unspecified;0.039603816071402176;kilogram;cement, unspecified;;technosphere;LAM;ecoinvent_cutoff_3.9_remind_SSP1-Base_2025;cement
7eba4555668563087546d146e049957d;market for cement, unspecified;RoW;cement, unspecified;;market for cement, unspecified;0.06970063211045749;kilogram;cement, unspecified;;technosphere;MEA;ecoinvent_cutoff_3.9_remind_SSP1-Base_2025;cement
7eba4555668563087546d146e049957d;market for cement, unspecified;RoW;cement, unspecified;;market for cement, unspecified;0.021922687122381105;kilogram;cement, unspecified;;technosphere;NEU;ecoinvent_cutoff_3.9_remind_SSP1-Base_2025;cement
7eba4555668563087546d146e049957d;market for cement, unspecified;RoW;cement, unspecified;;market for cement, unspecified;0.09994806597879244;kilogram;cement, unspecified;;technosphere;OAS;ecoinvent_cutoff_3.9_remind_SSP1-Base_2025;cement
7eba4555668563087546d146e049957d;market for cement, unspecified;RoW;cement, unspecified;;market for cement, unspecified;0.024651049617456573;kilogram;cement, unspecified;;technosphere;REF;ecoinvent_cutoff_3.9_remind_SSP1-Base_2025;cement
7eba4555668563087546d146e049957d;market for cement, unspecified;RoW;cement, unspecified;;market for cement, unspecified;0.023250306967711146;kilogram;cement, unspecified;;technosphere;SSA;ecoinvent_cutoff_3.9_remind_SSP1-Base_2025;cement
7eba4555668563087546d146e049957d;market for cement, unspecified;RoW;cement, unspecified;;market for cement, unspecified;0.01971912349198021;kilogram;cement, unspecified;;technosphere;USA;ecoinvent_cutoff_3.9_remind_SSP1-Base_2025;cement
7ebc7cac46844ce7bc26106b852bf677;cement production, type ICo;REF;cement, type ICo;;market for cement factory;5.36e-11;unit;cement factory;;technosphere;GLO;ecoinvent_cutoff_3.9_remind_SSP1-Base_2025;cement
7ec1cdee8e9b461594730ef0e8899b26;cement production, CEM III/C;OAS;cement, CEM III/C;;market for cement factory;5.36e-11;unit;cement factory;;technosphere;GLO;ecoinvent_cutoff_3.9_remind_SSP1-Base_2025;cement
7ecc07084fb4eec36e3fe3d826b46fcc;treatment of waste emulsion paint, hazardous waste incineration, with energy recovery;CH;waste emulsion paint;;market for cement, unspecified;0.2828;kilogram;cement, unspecified;;technosphere;NEU;ecoinvent_cutoff_3.9_remind_SSP1-Base_2025;cement
7f50195c9bbedd382d5d8c993b29d3c4;onshore well production, oil/gas;GLO;onshore well, oil/gas;;market for cement, Portland;199.99999999999997;kilogram;cement, Portland;;technosphere;World;ecoinvent_cutoff_3.9_remind_SSP1-Base_2025;cement
7f6d13cfaf4244264c9db06195e96069;deep well drilling, for deep geothermal power;MX;deep well, drilled, for geothermal power;;market for cement, Portland;211.0;kilogram;cement, Portland;;technosphere;LAM;ecoinvent_cutoff_3.9_remind_SSP1-Base_2025;cement
7f795fb33d8a866c67933c8d867da010;treatment of residues, MSWI-WWT, WW from pig iron production, residual material landfill;Europe without Switzerland;residues, MSWI-WWT, WW from pig iron production;;market for cement, unspecified;0.4;kilogram;cement, unspecified;;technosphere;EUR;ecoinvent_cutoff_3.9_remind_SSP1-Base_2025;cement
7fce902798cbbec1471cfe1b114fe906;deep well drilling, for deep geothermal power;US-HICC;deep well, drilled, for geothermal power;;market for cement, Portland;211.0;kilogram;cement, Portland;;technosphere;USA;ecoinvent_cutoff_3.9_remind_SSP1-Base_2025;cement
7fd9c8be68a973ed32aa98104dcdf8a5;electricity production, nuclear, pressure water reactor;CZ;electricity, high voltage;;market for cement, Portland;9.19e-07;kilogram;cement, Portland;;technosphere;EUR;ecoinvent_cutoff_3.9_remind_SSP1-Base_2025;cement
800f89721f4aa9b1627cf034e16188a0;treatment of waste plastic plaster, sanitary landfill;CH;waste plastic plaster, for final disposal;;market for cement, unspecified;3.28e-08;kilogram;cement, unspecified;;technosphere;NEU;ecoinvent_cutoff_3.9_remind_SSP1-Base_2025;cement
8033ff08fa8d4ec99071f450ec5b9807;cement production, Portland Slag;CAZ;cement, Portland Slag;;market for cement factory;5.36e-11;unit;cement factory;;technosphere;GLO;ecoinvent_cutoff_3.9_remind_SSP1-Base_2025;cement
805b10fa1f8148ce82a74813242c3613;cement production, CP IV;SSA;cement, CP IV;;market for cement factory;2.73e-11;unit;cement factory;;technosphere;GLO;ecoinvent_cutoff_3.9_remind_SSP1-Base_2025;cement
805e5979450444b81a2260d058718ceb;treatment of waste rubber, unspecified, municipal incineration;RoW;waste rubber, unspecified;;market for cement, unspecified;0.01227;kilogram;cement, unspecified;;technosphere;World;ecoinvent_cutoff_3.9_remind_SSP1-Base_2025;cement
805f4a4de641fc3ddf84ccc759aa445e;fibre cement roof slate production;RoW;fibre cement roof slate;;market for cement, CEM II/B;0.698;kilogram;cement, CEM II/B;;technosphere;World;ecoinvent_cutoff_3.9_remind_SSP1-Base_2025;cement
805fa864d6ef3092ca19e9a09294aa65;gold-silver mine operation and beneficiation;CA-QC;lead concentrate;;market for cement, Portland;0.12110877748076034;kilogram;cement, Portland;;technosphere;CAZ;ecoinvent_cutoff_3.9_remind_SSP1-Base_2025;cement
80774fccda0d4ec9a743f25b2a655493;cement production, CEM II/A-L;CHA;cement, CEM II/A-L;;market for cement factory;5.36e-11;unit;cement factory;;technosphere;GLO;ecoinvent_cutoff_3.9_remind_SSP1-Base_2025;cement
80ffe2bdca04421ed3f51963682ba5bf;hydropower plant construction, reservoir, non-alpine regions;RoW;hydropower plant, reservoir, non-alpine regions;;market for cement, Portland;8969999999.999998;kilogram;cement, Portland;;technosphere;World;ecoinvent_cutoff_3.9_remind_SSP1-Base_2025;cement
811130c953599484b577b0fb500e75ef;treatment of waste wire plastic, municipal incineration;RoW;waste wire plastic;;market for cement, unspecified;0.061065;kilogram;cement, unspecified;;technosphere;World;ecoinvent_cutoff_3.9_remind_SSP1-Base_2025;cement
81183f4ea509a8d9f1507e53820d6266;electricity production, nuclear, pressure water reactor;TW;electricity, high voltage;;market for cement, Portland;8.58102409639e-07;kilogram;cement, Portland;;technosphere;CHA;ecoinvent_cutoff_3.9_remind_SSP1-Base_2025;cement
818adb4f89c45dd47d26ab7c9e35ce8f;cement mortar production, hand-mixed, on-site;RoW;cement mortar;;market for cement, unspecified;0.2732;kilogram;cement, unspecified;;technosphere;World;ecoinvent_cutoff_3.9_remind_SSP1-Base_2025;cement
81cb117d4a764612bdecab2bb664b35a;cement production, type IS;OAS;cement, type IS;;market for cement factory;5.36e-11;unit;cement factory;;technosphere;GLO;ecoinvent_cutoff_3.9_remind_SSP1-Base_2025;cement
824724a6afe54508a2be73bee2b655b0;cement production, CEM II/A-V;OAS;cement, CEM II/A-V;;market for cement factory;5.36e-11;unit;cement factory;;technosphere;GLO;ecoinvent_cutoff_3.9_remind_SSP1-Base_2025;cement
825b7821b4cd45488af6d74c7bbdac3a;cement production, CEM II/B-V;LAM;cement, CEM II/B-V;;market for cement factory;5.36e-11;unit;cement factory;;technosphere;GLO;ecoinvent_cutoff_3.9_remind_SSP1-Base_2025;cement
8278297e8bf2da1c80335e1d5e813af8;treatment of residue from mechanical treatment, liquid crystal display, municipal waste incineration;RoW;residue from mechanical treatment, liquid crystal display;;market for cement, unspecified;0.008657700000000003;kilogram;cement, unspecified;;technosphere;World;ecoinvent_cutoff_3.9_remind_SSP1-Base_2025;cement
82dc0b95af394d5cad8e8afc55727070;cement production, CEM IV/B;LAM;cement, CEM IV/B;;market for cement factory;5.36e-11;unit;cement factory;;technosphere;GLO;ecoinvent_cutoff_3.9_remind_SSP1-Base_2025;cement
82f11102d86c9adb1a759ae6a7f65fff;deep well closure, for geothermal power, onshore, 6000m;GLO;deep well closure;;market for cement, CEM II/B;0.875;kilogram;cement, CEM II/B;;technosphere;World;ecoinvent_cutoff_3.9_remind_SSP1-Base_2025;cement
82f11102d86c9adb1a759ae6a7f65fff;deep well closure, for geothermal power, onshore, 6000m;GLO;deep well closure;;market for cement, Portland;0.8749999999999998;kilogram;cement, Portland;;technosphere;World;ecoinvent_cutoff_3.9_remind_SSP1-Base_2025;cement
82f1a04f494f460f8eafe1a901d86e77;cement production, CEM IV/A;EUR;cement, CEM IV/A;;market for cement factory;5.36e-11;unit;cement factory;;technosphere;GLO;ecoinvent_cutoff_3.9_remind_SSP1-Base_2025;cement
83237c344c83adaa165667c3a0b7126f;stone wool production;CH;stone wool;;market for cement, Portland;0.14501;kilogram;cement, Portland;;technosphere;NEU;ecoinvent_cutoff_3.9_remind_SSP1-Base_2025;cement
836f64f6fda5277cd6f0a94bbde62215;treatment of digester sludge, municipal incineration with fly ash extraction;CH;heat, for reuse in municipal waste incineration only;;market for cement, unspecified;0.0036527006007160217;kilogram;cement, unspecified;;technosphere;NEU;ecoinvent_cutoff_3.9_remind_SSP1-Base_2025;cement
8388a693576d48d49465261b16d45020;cement production, CEM II/A-L;NEU;cement, CEM II/A-L;;market for cement factory;5.36e-11;unit;cement factory;;technosphere;GLO;ecoinvent_cutoff_3.9_remind_SSP1-Base_2025;cement
839e0c2fc68cc05ebd55b0e48cd70be4;treatment of waste sealing sheet, polyvinylchloride, municipal incineration with fly ash extraction;CH;waste sealing sheet, polyvinylchloride;;market for cement, unspecified;0.027804;kilogram;cement, unspecified;;technosphere;NEU;ecoinvent_cutoff_3.9_remind_SSP1-Base_2025;cement
83c7ebb3359d1cfa1c48eab19f0c0d79;treatment of refinery sludge, hazardous waste incineration, with energy recovery;Europe without Switzerland;refinery sludge;;market for cement, unspecified;0.0055749;kilogram;cement, unspecified;;technosphere;EUR;ecoinvent_cutoff_3.9_remind_SSP1-Base_2025;cement
83c7f899c49fcbb0398e062bc96f2e7d;electricity production, nuclear, pressure water reactor;NL;electricity, high voltage;;market for cement, Portland;9.19e-07;kilogram;cement, Portland;;technosphere;EUR;ecoinvent_cutoff_3.9_remind_SSP1-Base_2025;cement
83f4cb6a6af743ed81468ebdb26817ab;cement production, type general use;CHA;cement, type general use;;market for cement factory;5.36e-11;unit;cement factory;;technosphere;GLO;ecoinvent_cutoff_3.9_remind_SSP1-Base_2025;cement
83fff5892fa1d8e585bad0d7ccd52019;lightweight concrete block production, expanded vermiculite;RoW;lightweight concrete block, expanded vermiculite;;market for cement, Portland;0.09999999999999999;kilogram;cement, Portland;;technosphere;World;ecoinvent_cutoff_3.9_remind_SSP1-Base_2025;cement
840ecf3de31b1354f2fc81073eb85a25;treatment of residues, MSWI[F]-WWT, WW from wafer fabrication, residual material landfill;CH;residues, MSWI[F]-WWT, WW from wafer fabrication;;market for cement, unspecified;0.4;kilogram;cement, unspecified;;technosphere;NEU;ecoinvent_cutoff_3.9_remind_SSP1-Base_2025;cement
8436bdffcc59431ab38dd664b7847820;cement production, CP III;CAZ;cement, CP III;;market for cement factory;2.73e-11;unit;cement factory;;technosphere;GLO;ecoinvent_cutoff_3.9_remind_SSP1-Base_2025;cement
84588a40489aa2b7e62000273d1ace44;treatment of waste polyvinylfluoride, municipal incineration with fly ash extraction;CH;waste polyvinylfluoride;;market for cement, unspecified;0.071272;kilogram;cement, unspecified;;technosphere;NEU;ecoinvent_cutoff_3.9_remind_SSP1-Base_2025;cement
84899860c1ab9232314deb64b013bf80;market for cement, ART;CO;cement, ART;;market for cement, ART;1.0;kilogram;cement, ART;;technosphere;LAM;ecoinvent_cutoff_3.9_remind_SSP1-Base_2025;cement
85680403804249c7bb069849cde87d19;cement production, CEM V/B;USA;cement, CEM V/B;;market for cement factory;5.36e-11;unit;cement factory;;technosphere;GLO;ecoinvent_cutoff_3.9_remind_SSP1-Base_2025;cement
85a5cdec6c0562f0995190af7d6ec187;treatment of residues, MSWI[F]-WWT, WW from LCD backlight production, residual material landfill;CH;residues, MSWI[F]-WWT, WW from LCD backlight production;;market for cement, unspecified;0.4;kilogram;cement, unspecified;;technosphere;NEU;ecoinvent_cutoff_3.9_remind_SSP1-Base_2025;cement
85d8ffa2cbdb4872deb5ec394243d4f4;treatment of residues, MSWI[F]-WWT, heat carrier liquid, 40% C3H8O2, residual material landfill;CH;residues, MSWI[F]-WWT, heat carrier liquid, 40% C3H8O2;;market for cement, unspecified;0.4;kilogram;cement, unspecified;;technosphere;NEU;ecoinvent_cutoff_3.9_remind_SSP1-Base_2025;cement
8638f69cc91542c598d6235727447515;cement production, type I (SM);NEU;cement, type I (SM);;market for cement factory;5.36e-11;unit;cement factory;;technosphere;GLO;ecoinvent_cutoff_3.9_remind_SSP1-Base_2025;cement
8657f4c6520411c2881954da2c789b0d;concrete production, 30MPa, for building construction, with cement, CP-II-F;BR;concrete, 30MPa;;market for cement, CP II-F;306.21;kilogram;cement, CP II-F;;technosphere;LAM;ecoinvent_cutoff_3.9_remind_SSP1-Base_2025;cement
8679c0eadf6c4ac29f3408d025579629;cement production, CP III;World;cement, CP III;;market for cement factory;2.73e-11;unit;cement factory;;technosphere;GLO;ecoinvent_cutoff_3.9_remind_SSP1-Base_2025;cement
867a421b30b744799cced1f4dd992e09;cement production, CEM II/B-S;NEU;cement, CEM II/B-S;;market for cement factory;5.36e-11;unit;cement factory;;technosphere;GLO;ecoinvent_cutoff_3.9_remind_SSP1-Base_2025;cement
8716c8b6f2df996ded54c67472212da9;market for cement, CEM III/A;RoW;cement, CEM III/A;;market for cement, CEM III/A;0.005258403890252714;kilogram;cement, CEM III/A;;technosphere;CAZ;ecoinvent_cutoff_3.9_remind_SSP1-Base_2025;cement
8716c8b6f2df996ded54c67472212da9;market for cement, CEM III/A;RoW;cement, CEM III/A;;market for cement, CEM III/A;0.5661374923826646;kilogram;cement, CEM III/A;;technosphere;CHA;ecoinvent_cutoff_3.9_remind_SSP1-Base_2025;cement
8716c8b6f2df996ded54c67472212da9;market for cement, CEM III/A;RoW;cement, CEM III/A;;market for cement, CEM III/A;0.03724665442408569;kilogram;cement, CEM III/A;;technosphere;EUR;ecoinvent_cutoff_3.9_remind_SSP1-Base_2025;cement
8716c8b6f2df996ded54c67472212da9;market for cement, CEM III/A;RoW;cement, CEM III/A;;market for cement, CEM III/A;0.08110087960988153;kilogram;cement, CEM III/A;;technosphere;IND;ecoinvent_cutoff_3.9_remind_SSP1-Base_2025;cement
8716c8b6f2df996ded54c67472212da9;market for cement, CEM III/A;RoW;cement, CEM III/A;;market for cement, CEM III/A;0.011460888332934254;kilogram;cement, CEM III/A;;technosphere;JPN;ecoinvent_cutoff_3.9_remind_SSP1-Base_2025;cement
8716c8b6f2df996ded54c67472212da9;market for cement, CEM III/A;RoW;cement, CEM III/A;;market for cement, CEM III/A;0.039603816071402176;kilogram;cement, CEM III/A;;technosphere;LAM;ecoinvent_cutoff_3.9_remind_SSP1-Base_2025;cement
8716c8b6f2df996ded54c67472212da9;market for cement, CEM III/A;RoW;cement, CEM III/A;;market for cement, CEM III/A;0.06970063211045749;kilogram;cement, CEM III/A;;technosphere;MEA;ecoinvent_cutoff_3.9_remind_SSP1-Base_2025;cement
8716c8b6f2df996ded54c67472212da9;market for cement, CEM III/A;RoW;cement, CEM III/A;;market for cement, CEM III/A;0.021922687122381105;kilogram;cement, CEM III/A;;technosphere;NEU;ecoinvent_cutoff_3.9_remind_SSP1-Base_2025;cement
8716c8b6f2df996ded54c67472212da9;market for cement, CEM III/A;RoW;cement, CEM III/A;;market for cement, CEM III/A;0.09994806597879244;kilogram;cement, CEM III/A;;technosphere;OAS;ecoinvent_cutoff_3.9_remind_SSP1-Base_2025;cement
8716c8b6f2df996ded54c67472212da9;market for cement, CEM III/A;RoW;cement, CEM III/A;;market for cement, CEM III/A;0.024651049617456573;kilogram;cement, CEM III/A;;technosphere;REF;ecoinvent_cutoff_3.9_remind_SSP1-Base_2025;cement
8716c8b6f2df996ded54c67472212da9;market for cement, CEM III/A;RoW;cement, CEM III/A;;market for cement, CEM III/A;0.023250306967711146;kilogram;cement, CEM III/A;;technosphere;SSA;ecoinvent_cutoff_3.9_remind_SSP1-Base_2025;cement
8716c8b6f2df996ded54c67472212da9;market for cement, CEM III/A;RoW;cement, CEM III/A;;market for cement, CEM III/A;0.01971912349198021;kilogram;cement, CEM III/A;;technosphere;USA;ecoinvent_cutoff_3.9_remind_SSP1-Base_2025;cement
8722611b475534e680cf5a275f27b9c8;treatment of residue from mechanical treatment, cathode ray tube display, municipal waste incineration;RoW;residue from mechanical treatment, cathode ray tube display;;market for cement, unspecified;0.0081938;kilogram;cement, unspecified;;technosphere;World;ecoinvent_cutoff_3.9_remind_SSP1-Base_2025;cement
880c8f4777e840b5b36f576e1c02e66f;cement production, CP II-F;NEU;cement, CP II-F;;market for cement factory;2.73e-11;unit;cement factory;;technosphere;GLO;ecoinvent_cutoff_3.9_remind_SSP1-Base_2025;cement
88226b20cf7e7a742765cb414af88460;treatment of waste paint, hazardous waste incineration;RoW;waste paint;;market for cement, unspecified;0.011831;kilogram;cement, unspecified;;technosphere;World;ecoinvent_cutoff_3.9_remind_SSP1-Base_2025;cement
88305abbe4c02d901cf28b985602f3ba;treatment of hazardous waste, hazardous waste incineration, with energy recovery;CH;hazardous waste, for incineration;;market for cement, unspecified;0.075605;kilogram;cement, unspecified;;technosphere;NEU;ecoinvent_cutoff_3.9_remind_SSP1-Base_2025;cement
8836014bba344235835167e9c9592763;cement production, CEM II/B;MEA;cement, CEM II/B;;market for cement factory;5.36e-11;unit;cement factory;;technosphere;GLO;ecoinvent_cutoff_3.9_remind_SSP1-Base_2025;cement
883c684bd91355526fce6107dada841d;treatment of spent solvent mixture, hazardous waste incineration;CH;spent solvent mixture;;market for cement, unspecified;0.030252;kilogram;cement, unspecified;;technosphere;NEU;ecoinvent_cutoff_3.9_remind_SSP1-Base_2025;cement
88567c0c14c22bf68b91250b6b703fbd;treatment of municipal solid waste, incineration;NO;municipal solid waste;;market for cement, unspecified;0.008896;kilogram;cement, unspecified;;technosphere;NEU;ecoinvent_cutoff_3.9_remind_SSP1-Base_2025;cement
886c60d00a79d172ed7f51b97cd515ce;treatment of waste sealing sheet, polyvinylchloride, municipal incineration;RoW;waste sealing sheet, polyvinylchloride;;market for cement, unspecified;0.051694000000000004;kilogram;cement, unspecified;;technosphere;World;ecoinvent_cutoff_3.9_remind_SSP1-Base_2025;cement
896fbfff5846433175f6b669901ced70;market for cement, CP II-F;BR;cement, CP II-F;;market for cement, CP II-F;1.0;kilogram;cement, CP II-F;;technosphere;LAM;ecoinvent_cutoff_3.9_remind_SSP1-Base_2025;cement
89a9c0244fe05a9dd8ffcc594a62efd7;lime mortar production;RoW;lime mortar;;market for cement, Portland;0.5600000000000002;kilogram;cement, Portland;;technosphere;World;ecoinvent_cutoff_3.9_remind_SSP1-Base_2025;cement
8a05ebfb0d1cdf2fbcf64d3806c4b85f;garage construction, wood, non-insulated, fire-protected;CH;garage, wood, non-insulated, fire-protected;;market for cement, Portland;58.637;kilogram;cement, Portland;;technosphere;NEU;ecoinvent_cutoff_3.9_remind_SSP1-Base_2025;cement
8a16897ced080b732622462386de88aa;concrete production, 25MPa, for building construction, with cement, CP-II-E;BR;concrete, 25MPa;;market for cement, CP II-E;242.892;kilogram;cement, CP II-E;;technosphere;LAM;ecoinvent_cutoff_3.9_remind_SSP1-Base_2025;cement
