code;name;location;reference product;categories;ex_name;ex_amount;ex_unit;ex_product;ex_production volume;ex_type;ex_location;database;material_group
ad376d4595c073f0f1c116a8f3954914;treatment of waste paint, hazardous waste incineration, with energy recovery;Europe without Switzerland;waste paint;;market for cement, unspecified;0.011831;kilogram;cement, unspecified;;technosphere;EUR;ecoinvent_cutoff_3.9_remind_SSP2-Base_2100;cement
ad6d0f2a8b45536da196238df879077b;treatment of waste mineral oil, hazardous waste incineration, with energy recovery;Europe without Switzerland;waste mineral oil;;market for cement, unspecified;0.0045705;kilogram;cement, unspecified;;technosphere;EUR;ecoinvent_cutoff_3.9_remind_SSP2-Base_2100;cement
ada973c759024cb8a3d35a7619d736c3;cement production, type ICo;USA;cement, type ICo;;market for cement factory;5.36e-11;unit;cement factory;;technosphere;GLO;ecoinvent_cutoff_3.9_remind_SSP2-Base_2100;cement
ae559eb2d0b8bdffc2290f7ad28ece8a;treatment of waste bitumen, sanitary landfill;RoW;waste bitumen;;market for cement, unspecified;7.859999999999999e-08;kilogram;cement, unspecified;;technosphere;World;ecoinvent_cutoff_3.9_remind_SSP2-Base_2100;cement
ae7b0ce46d7c8e1d2d2c6acd9f35f643;treatment of municipal solid waste, sanitary landfill;CA-QC;municipal solid waste;;market for cement, unspecified;3.66e-05;kilogram;cement, unspecified;;technosphere;CAZ;ecoinvent_cutoff_3.9_remind_SSP2-Base_2100;cement
aef1e986eeba4ca29ef127dab3ff9e7b;treatment, effluent from NF3 production, to wastewater treatment, class 3;CH;treatment, effluent from NF3 production, to wastewater treatment, class 3;;market for cement, Portland;0.05628;kilogram;cement, Portland;;technosphere;NEU;ecoinvent_cutoff_3.9_remind_SSP2-Base_2100;cement
aef9769c28c7a6e5133e9684d53ce3c4;concrete production, 35MPa, for building construction, with cement, CP-II-E;BR;concrete, 35MPa;;market for cement, CP II-E;326.97;kilogram;cement, CP II-E;;technosphere;LAM;ecoinvent_cutoff_3.9_remind_SSP2-Base_2100;cement
af174472036946d2932b431b6e54b0b4;cement production, ART;USA;cement, ART;;market for cement factory;5.36e-11;unit;cement factory;;technosphere;GLO;ecoinvent_cutoff_3.9_remind_SSP2-Base_2100;cement
af2df6a1c2a147a6872746c2abacf64d;cement production, Pozzolana Portland;MEA;cement, Pozzolana Portland;;market for cement factory;5.36e-11;unit;cement factory;;technosphere;GLO;ecoinvent_cutoff_3.9_remind_SSP2-Base_2100;cement
af3f59339e50faf431500f43f4f278b9;treatment of H3PO4 purification residue, residual material landfill;RoW;H3PO4 purification residue;;market for cement, unspecified;0.4;kilogram;cement, unspecified;;technosphere;World;ecoinvent_cutoff_3.9_remind_SSP2-Base_2100;cement
af4532386c6944ec96e6f6c8eea391ef;cement production, CP II-F;CAZ;cement, CP II-F;;market for cement factory;2.73e-11;unit;cement factory;;technosphere;GLO;ecoinvent_cutoff_3.9_remind_SSP2-Base_2100;cement
af7478a12fa706a1932ad229bd4ee9fa;treatment of waste wood pole, chrome preserved, municipal incineration with fly ash extraction;CH;waste wood pole, chrome preserved;;market for cement, unspecified;0.00094977;kilogram;cement, unspecified;;technosphere;NEU;ecoinvent_cutoff_3.9_remind_SSP2-Base_2100;cement
afc691796e514ec5b7a1995af14c018f;cement production, type IS;OAS;cement, type IS;;market for cement factory;5.36e-11;unit;cement factory;;technosphere;GLO;ecoinvent_cutoff_3.9_remind_SSP2-Base_2100;cement
afe962cc6b444be759cba60f5373df5f;treatment of waste bitumen, sanitary landfill;Europe without Switzerland;waste bitumen;;market for cement, unspecified;7.86e-08;kilogram;cement, unspecified;;technosphere;EUR;ecoinvent_cutoff_3.9_remind_SSP2-Base_2100;cement
b02c86b604804505a173c29fff2a53ea;cement production, CEM III/B;REF;cement, CEM III/B;;market for cement factory;5.36e-11;unit;cement factory;;technosphere;GLO;ecoinvent_cutoff_3.9_remind_SSP2-Base_2100;cement
b056dcefa9c8433ba79630051c413baf;concrete production, 30MPa, for building construction, with cement, CP-II-E;BR;concrete, 30MPa;;market for cement, CP II-E;293.754;kilogram;cement, CP II-E;;technosphere;LAM;ecoinvent_cutoff_3.9_remind_SSP2-Base_2100;cement
b0c2790911e54180a07147cca94d7076;cement production, CEM II/A;REF;cement, CEM II/A;;market for cement factory;5.36e-11;unit;cement factory;;technosphere;GLO;ecoinvent_cutoff_3.9_remind_SSP2-Base_2100;cement
b0cdf233c34d4c82b98cb58f9c601002;cement production, CP III;USA;cement, CP III;;market for cement factory;2.73e-11;unit;cement factory;;technosphere;GLO;ecoinvent_cutoff_3.9_remind_SSP2-Base_2100;cement
b0d70c147eb7c978befe9a68571bcf7d;gold-silver mine operation and beneficiation;CA-QC;copper concentrate, sulfide ore;;market for cement, Portland;0.2706266862003588;kilogram;cement, Portland;;technosphere;CAZ;ecoinvent_cutoff_3.9_remind_SSP2-Base_2100;cement
b0e774011815477990f7df7e5a58bcbb;cement production, CEM II/A-V;IND;cement, CEM II/A-V;;market for cement factory;5.36e-11;unit;cement factory;;technosphere;GLO;ecoinvent_cutoff_3.9_remind_SSP2-Base_2100;cement
b15aa4cedf0b8a605f0641c9822c9626;concrete production, 35MPa, with cement, CEM II/B;GLO;concrete, 35MPa;;market for cement, CEM II/B;348.54551174496595;kilogram;cement, CEM II/B;;technosphere;World;ecoinvent_cutoff_3.9_remind_SSP2-Base_2100;cement
b1b8ce2ea140498ab5898fa3ddb1a40d;cement production, CEM II/A;MEA;cement, CEM II/A;;market for cement factory;5.36e-11;unit;cement factory;;technosphere;GLO;ecoinvent_cutoff_3.9_remind_SSP2-Base_2100;cement
b1ce4dc3a9f9461c90771b6340e9f01a;cement production, CP II-F;SSA;cement, CP II-F;;market for cement factory;2.73e-11;unit;cement factory;;technosphere;GLO;ecoinvent_cutoff_3.9_remind_SSP2-Base_2100;cement
b214bf9b5dc3443cbd3f7fb5a995d665;cement production, CP III;CHA;cement, CP III;;market for cement factory;2.73e-11;unit;cement factory;;technosphere;GLO;ecoinvent_cutoff_3.9_remind_SSP2-Base_2100;cement
b273b68a0ef1e87a067d0c502caf61a2;treatment of waste frit from cathode ray tube production, residual material landfill;RoW;waste frit from cathode ray tube production;;market for cement, unspecified;0.4;kilogram;cement, unspecified;;technosphere;World;ecoinvent_cutoff_3.9_remind_SSP2-Base_2100;cement
b2d4450fa2f1359ed5bafa47c7425fb0;electricity production, nuclear, boiling water reactor;FI;electricity, high voltage;;market for cement, Portland;7.71e-06;kilogram;cement, Portland;;technosphere;EUR;ecoinvent_cutoff_3.9_remind_SSP2-Base_2100;cement
b2f505be00479564a5d05607481f45e7;ground granulated blast furnace slag production;IN;ground granulated blast furnace slag;;market for cement factory;5.360000000000001e-11;unit;cement factory;0.0;technosphere;GLO;ecoinvent_cutoff_3.9_remind_SSP2-Base_2100;cement
b325ebc94b2c4c4ca94dc153ec207732;cement production, CEM III/C;CHA;cement, CEM III/C;;market for cement factory;5.36e-11;unit;cement factory;;technosphere;GLO;ecoinvent_cutoff_3.9_remind_SSP2-Base_2100;cement
b35cf1d7fd6f4b2fa2360c8d4da0b56d;cement production, CEM III/B;CHA;cement, CEM III/B;;market for cement factory;5.36e-11;unit;cement factory;;technosphere;GLO;ecoinvent_cutoff_3.9_remind_SSP2-Base_2100;cement
b39e7aaf750f2799d46c5df96a55ffb2;treatment of spent anion exchange resin from potable water production, municipal incineration;CH;spent anion exchange resin from potable water production;;market for cement, unspecified;0.00966;kilogram;cement, unspecified;;technosphere;NEU;ecoinvent_cutoff_3.9_remind_SSP2-Base_2100;cement
b3bff7b0a5d7f8045054210d4445281f;treatment of municipal solid waste, incineration;SE;municipal solid waste;;market for cement, unspecified;0.008896;kilogram;cement, unspecified;;technosphere;EUR;ecoinvent_cutoff_3.9_remind_SSP2-Base_2100;cement
b3ef8a2c866440fb9c411b65f44aecae;cement production, type ICo;CHA;cement, type ICo;;market for cement factory;5.36e-11;unit;cement factory;;technosphere;GLO;ecoinvent_cutoff_3.9_remind_SSP2-Base_2100;cement
b405b90b744057bb9cd842122f9ebd0d;treatment of spent nuclear fuel, reprocessing;RoW;spent nuclear fuel;;market for cement, unspecified;4.0;kilogram;cement, unspecified;;technosphere;World;ecoinvent_cutoff_3.9_remind_SSP2-Base_2100;cement
b45cc2a0c61648418f865840b7dabbd4;cement production, type S;EUR;cement, type S;;market for cement factory;5.36e-11;unit;cement factory;;technosphere;GLO;ecoinvent_cutoff_3.9_remind_SSP2-Base_2100;cement
b45f2d6d03e7426bbf0ea228a8bee3ca;cement production, CEM II/B-S;SSA;cement, CEM II/B-S;;market for cement factory;5.36e-11;unit;cement factory;;technosphere;GLO;ecoinvent_cutoff_3.9_remind_SSP2-Base_2100;cement
b510de7c6fcf4f3abf57dce2cdca429f;cement production, CP II-F;LAM;cement, CP II-F;;market for cement factory;2.73e-11;unit;cement factory;;technosphere;GLO;ecoinvent_cutoff_3.9_remind_SSP2-Base_2100;cement
b52052e77f416f5b21c3c3dd80a44841;treatment of hazardous waste, underground deposit;RoW;hazardous waste, for underground deposit;;market for cement mortar;0.000515;kilogram;cement mortar;;technosphere;World;ecoinvent_cutoff_3.9_remind_SSP2-Base_2100;cement
b5991a82eae14704985ab9b88e76a295;cement production, CEM IV/B;World;cement, CEM IV/B;;market for cement factory;5.36e-11;unit;cement factory;;technosphere;GLO;ecoinvent_cutoff_3.9_remind_SSP2-Base_2100;cement
b59a77b8622e4643b03f792964d2c8b0;cement production, CEM V/A;CHA;cement, CEM V/A;;market for cement factory;5.36e-11;unit;cement factory;;technosphere;GLO;ecoinvent_cutoff_3.9_remind_SSP2-Base_2100;cement
b5c63b17816586b0440b6cf0ebf1ad26;concrete production, 45MPa, with cement, CEM II/B-V;ZA;concrete, 45MPa;;market for cement, CEM II/B-V;468.722891566265;kilogram;cement, CEM II/B-V;;technosphere;SSA;ecoinvent_cutoff_3.9_remind_SSP2-Base_2100;cement
b5ec75b073a74a41a3793d692effe649;cement production, type IP/P;World;cement, type IP/P;;market for cement factory;5.36e-11;unit;cement factory;;technosphere;GLO;ecoinvent_cutoff_3.9_remind_SSP2-Base_2100;cement
b61220be0d344c40eb5c629232c9c223;treatment of municipal solid waste, incineration;CA-QC;municipal solid waste;;market for cement, unspecified;0.008896;kilogram;cement, unspecified;;technosphere;CAZ;ecoinvent_cutoff_3.9_remind_SSP2-Base_2100;cement
b613a0b81feac8d2681dbae87afaf18f;market for cement, type I-PM;US;cement, type I-PM;;market for cement, type I-PM;1.0;kilogram;cement, type I-PM;;technosphere;USA;ecoinvent_cutoff_3.9_remind_SSP2-Base_2100;cement
b62fb45311ac4a51aec46dffb82aca5c;MOX fuel element for LWR, at nuclear fuel fabrication plant;FR;MOX fuel element for LWR, at nuclear fuel fabrication plant;;market for cement, Portland;0.0065;kilogram;cement, Portland;;technosphere;EUR;ecoinvent_cutoff_3.9_remind_SSP2-Base_2100;cement
b64aac4bf4e1e5f744f404facb1d0763;pipeline construction, natural gas, low pressure distribution network;RoW;pipeline, natural gas, low pressure distribution network;;market for cement, unspecified;2840.0;kilogram;cement, unspecified;;technosphere;World;ecoinvent_cutoff_3.9_remind_SSP2-Base_2100;cement
b6b3d4ff801b49f8b64a99042ef54fce;cement production, type I-PM;MEA;cement, type I-PM;;market for cement factory;5.36e-11;unit;cement factory;;technosphere;GLO;ecoinvent_cutoff_3.9_remind_SSP2-Base_2100;cement
b6d708eeae756488a45fbc9fa7069b78;concrete production, 25MPa, for building construction, with cement, CEM III/A;GLO;concrete, 25MPa;;market for cement, CEM III/A;316.5899999999999;kilogram;cement, CEM III/A;;technosphere;World;ecoinvent_cutoff_3.9_remind_SSP2-Base_2100;cement
b6f1f6f69aef4aa5a142156804b19b6a;cement production, CEM V/A;JPN;cement, CEM V/A;;market for cement factory;5.36e-11;unit;cement factory;;technosphere;GLO;ecoinvent_cutoff_3.9_remind_SSP2-Base_2100;cement
b744f5535e28d4cb18c4fc958f388acd;treatment of spent activated carbon with mercury, underground deposit;RoW;spent activated carbon with mercury;;market for cement mortar;0.000515;kilogram;cement mortar;;technosphere;World;ecoinvent_cutoff_3.9_remind_SSP2-Base_2100;cement
b74e1cd8f63d08deb2510343706248d3;electricity production, nuclear, pressure water reactor;CH;electricity, high voltage;;market for cement, Portland;9.19e-07;kilogram;cement, Portland;;technosphere;NEU;ecoinvent_cutoff_3.9_remind_SSP2-Base_2100;cement
b74e1cd8f63d08deb2510343706248d3;electricity production, nuclear, pressure water reactor;CH;electricity, high voltage;;market for cement, unspecified;9e-07;kilogram;cement, unspecified;;technosphere;NEU;ecoinvent_cutoff_3.9_remind_SSP2-Base_2100;cement
b7d3a0fd6c740e74321b258671b8aa63;treatment of waste polyurethane, municipal incineration;CH;waste polyurethane;;market for cement, unspecified;0.00234;kilogram;cement, unspecified;;technosphere;NEU;ecoinvent_cutoff_3.9_remind_SSP2-Base_2100;cement
b7e4df5ef33c978f5604a0df6949fd1a;treatment of municipal solid waste, incineration;BE;municipal solid waste;;market for cement, unspecified;0.008896;kilogram;cement, unspecified;;technosphere;EUR;ecoinvent_cutoff_3.9_remind_SSP2-Base_2100;cement
b7e9431d24c54d49b4ffdbe5bfcd2687;cement production, type IS;CHA;cement, type IS;;market for cement factory;5.36e-11;unit;cement factory;;technosphere;GLO;ecoinvent_cutoff_3.9_remind_SSP2-Base_2100;cement
b7f7a6a1386b4d1655202d94166e40fd;treatment of waste, from silicon wafer production, underground deposit;RoW;waste, from silicon wafer production;;market for cement mortar;0.000515;kilogram;cement mortar;;technosphere;World;ecoinvent_cutoff_3.9_remind_SSP2-Base_2100;cement
b82438f1f676448180631a0ce9887c66;treatment of refinery sludge, hazardous waste incineration, with energy recovery;RoW;refinery sludge;;market for cement, unspecified;0.0055749;kilogram;cement, unspecified;;technosphere;World;ecoinvent_cutoff_3.9_remind_SSP2-Base_2100;cement
b8911eae4015a582b9c4e9731a739730;concrete production, 40MPa, for building construction, with cement, CP III;BR;concrete, 40MPa;;market for cement, CP III;431.808;kilogram;cement, CP III;;technosphere;LAM;ecoinvent_cutoff_3.9_remind_SSP2-Base_2100;cement
b8a872f96328eea538961081b63ea467;concrete production, 20MPa, self-construction, for building construction, with cement, type IP;PE;concrete, 20MPa;;market for cement, type IP;393.975;kilogram;cement, type IP;;technosphere;LAM;ecoinvent_cutoff_3.9_remind_SSP2-Base_2100;cement
b8eec0ebb20533ef6d2728fea9438fb1;treatment of waste textile, soiled, municipal incineration with fly ash extraction;CH;waste textile, soiled;;market for cement, unspecified;0.0034128;kilogram;cement, unspecified;;technosphere;NEU;ecoinvent_cutoff_3.9_remind_SSP2-Base_2100;cement
b9160b645261fe1365be648fd04a9141;fibre cement facing tile production, large format;CH;fibre cement facing tile, large format;;market for cement, Portland;0.90944;kilogram;cement, Portland;;technosphere;NEU;ecoinvent_cutoff_3.9_remind_SSP2-Base_2100;cement
b937cdeb576b448592c01137254d63ec;cement production, CEM III/A;JPN;cement, CEM III/A;;market for cement factory;5.36e-11;unit;cement factory;;technosphere;GLO;ecoinvent_cutoff_3.9_remind_SSP2-Base_2100;cement
b94622e4d8db8fed88fb8276ddca94fe;uranium fuel element production, enriched 4%, for light water reactor;UCTE without Germany;uranium, enriched 4%, in fuel element for light water reactor;;market for cement, unspecified;0.0065;kilogram;cement, unspecified;;technosphere;EUR;ecoinvent_cutoff_3.9_remind_SSP2-Base_2100;cement
b9468e305110461b8993c794a69954a9;cement production, CP II-Z;SSA;cement, CP II-Z;;market for cement factory;2.73e-11;unit;cement factory;;technosphere;GLO;ecoinvent_cutoff_3.9_remind_SSP2-Base_2100;cement
b96f605497729697a6722cf008f1c62b;market for cement, unspecified;CH;cement, unspecified;;market for cement, unspecified;1.0;kilogram;cement, unspecified;;technosphere;NEU;ecoinvent_cutoff_3.9_remind_SSP2-Base_2100;cement
b98f7051abb38cf81cd4f402894e0759;treatment of waste polyvinylchloride, municipal incineration;CH;waste polyvinylchloride;;market for cement, unspecified;0.00551;kilogram;cement, unspecified;;technosphere;NEU;ecoinvent_cutoff_3.9_remind_SSP2-Base_2100;cement
b996c7f0f02546f09eddca343b326459;cement production, Portland Slag;NEU;cement, Portland Slag;;market for cement factory;5.36e-11;unit;cement factory;;technosphere;GLO;ecoinvent_cutoff_3.9_remind_SSP2-Base_2100;cement
b9ad9b91cc074e3181f20412728b271f;cement production, CEM II/A;OAS;cement, CEM II/A;;market for cement factory;5.36e-11;unit;cement factory;;technosphere;GLO;ecoinvent_cutoff_3.9_remind_SSP2-Base_2100;cement
b9c63a5ddfec48a654c4d6d167b69ff8;treatment of waste emulsion paint, sanitary landfill;RoW;waste emulsion paint;;market for cement, unspecified;5.900000000000001e-06;kilogram;cement, unspecified;;technosphere;World;ecoinvent_cutoff_3.9_remind_SSP2-Base_2100;cement
b9c66a8cdc31633a6677ec3ade179892;treatment of hazardous waste, hazardous waste incineration;Europe without Switzerland;hazardous waste, for incineration;;market for cement, unspecified;0.075605;kilogram;cement, unspecified;;technosphere;EUR;ecoinvent_cutoff_3.9_remind_SSP2-Base_2100;cement
ba18852eb262bc76d482a87b2c2ab8b6;treatment of waste paperboard, municipal incineration;CH;waste paperboard;;market for cement, unspecified;0.00138;kilogram;cement, unspecified;;technosphere;NEU;ecoinvent_cutoff_3.9_remind_SSP2-Base_2100;cement
ba1c63ee0d566645c4c20c9e282ef0ba;treatment of municipal solid waste, incineration;CA-AB;municipal solid waste;;market for cement, unspecified;0.008896;kilogram;cement, unspecified;;technosphere;CAZ;ecoinvent_cutoff_3.9_remind_SSP2-Base_2100;cement
ba2e7057d619c2344531130632d477d7;treatment of municipal solid waste, incineration;FR;municipal solid waste;;market for cement, unspecified;0.008896;kilogram;cement, unspecified;;technosphere;EUR;ecoinvent_cutoff_3.9_remind_SSP2-Base_2100;cement
ba3216f12faf4010aef37778ef06a4bc;cement production, type I (SM);World;cement, type I (SM);;market for cement factory;5.36e-11;unit;cement factory;;technosphere;GLO;ecoinvent_cutoff_3.9_remind_SSP2-Base_2100;cement
ba468357c7ce028f71cfa60295fabc9d;tower silo production, plastic;CH;tower silo, plastic;;market for cement, Portland;11.2;kilogram;cement, Portland;;technosphere;NEU;ecoinvent_cutoff_3.9_remind_SSP2-Base_2100;cement
ba65494ba088406e971f87c3c9a176f6;cement production, CEM II/A;SSA;cement, CEM II/A;;market for cement factory;5.36e-11;unit;cement factory;;technosphere;GLO;ecoinvent_cutoff_3.9_remind_SSP2-Base_2100;cement
ba6b7f905075f479591950d35fb09235;transmission network construction, electricity, high voltage direct current aerial line;RER;transmission network, electricity, high voltage direct current aerial line;;market for cement, unspecified;65.0;kilogram;cement, unspecified;;technosphere;EUR;ecoinvent_cutoff_3.9_remind_SSP2-Base_2100;cement
ba965181f1674bb0aa8aa6500c9d2c62;cement production, CP IV;OAS;cement, CP IV;;market for cement factory;2.73e-11;unit;cement factory;;technosphere;GLO;ecoinvent_cutoff_3.9_remind_SSP2-Base_2100;cement
baacfa40ab20a187d037b569b8a7fca2;electricity production, nuclear, pressure water reactor;GB;electricity, high voltage;;market for cement, Portland;9.19e-07;kilogram;cement, Portland;;technosphere;EUR;ecoinvent_cutoff_3.9_remind_SSP2-Base_2100;cement
bab19123eb6a49949f2f7bd945b674ce;deep well drilling, for deep geothermal heat;RME;deep well, drilled, for geothermal heat;;market for cement, Portland;211.0;kilogram;cement, Portland;;technosphere;MEA;ecoinvent_cutoff_3.9_remind_SSP2-Base_2100;cement
bb1b23643a9a87a9a614925cca7062fc;concrete production, 25MPa, for building construction, exposure class XC2, with cement, unspecified;AT;concrete, 25MPa;;market for cement, unspecified;251.6591;kilogram;cement, unspecified;;technosphere;EUR;ecoinvent_cutoff_3.9_remind_SSP2-Base_2100;cement
bb4ec57a442e4cc4acd20dd8e665a101;cement production, CEM II/B;IND;cement, CEM II/B;;market for cement factory;5.36e-11;unit;cement factory;;technosphere;GLO;ecoinvent_cutoff_3.9_remind_SSP2-Base_2100;cement
bb55614763ad8438c61f5c6767cd2e1b;fibre cement roof slate production;CH;fibre cement roof slate;;market for cement, CEM II/B;0.698;kilogram;cement, CEM II/B;;technosphere;NEU;ecoinvent_cutoff_3.9_remind_SSP2-Base_2100;cement
bb79a1b44aa24150b0d5a64dc5c079dd;cement production, type S;World;cement, type S;;market for cement factory;5.36e-11;unit;cement factory;;technosphere;GLO;ecoinvent_cutoff_3.9_remind_SSP2-Base_2100;cement
bb8275bacefe29e1a171485e4ff44c73;unreinforced concrete production, 15MPa, with cement, CEM II/A;CH;unreinforced concrete, 15MPa;;market for cement, CEM II/A;200.0;kilogram;cement, CEM II/A;;technosphere;NEU;ecoinvent_cutoff_3.9_remind_SSP2-Base_2100;cement
bbbbe2c96fe59a4f5d49c52b62f90acb;deep well drilling, for deep geothermal power;NI;deep well, drilled, for geothermal power;;market for cement, Portland;211.0;kilogram;cement, Portland;;technosphere;LAM;ecoinvent_cutoff_3.9_remind_SSP2-Base_2100;cement
bbf2b21eaa23388f22792e7236a38934;treatment of waste plastic, mixture, municipal incineration;CH;waste plastic, mixture;;market for cement, unspecified;0.00264;kilogram;cement, unspecified;;technosphere;NEU;ecoinvent_cutoff_3.9_remind_SSP2-Base_2100;cement
bc01c4ff19799422c7da96847fe6a24e;treatment of bilge oil, hazardous waste incineration, with energy recovery;CH;bilge oil;;market for cement, unspecified;0.00057019;kilogram;cement, unspecified;;technosphere;NEU;ecoinvent_cutoff_3.9_remind_SSP2-Base_2100;cement
bc4d88972c064e93bda1da184b69a4dd;cement production, CP IV;MEA;cement, CP IV;;market for cement factory;2.73e-11;unit;cement factory;;technosphere;GLO;ecoinvent_cutoff_3.9_remind_SSP2-Base_2100;cement
bd3b97ff5baf3877244af92336a87e0a;market for cement, CEM V/A;CH;cement, CEM V/A;;market for cement, CEM V/A;1.0;kilogram;cement, CEM V/A;;technosphere;NEU;ecoinvent_cutoff_3.9_remind_SSP2-Base_2100;cement
bd50c07ba8ed4b83a3bdb3efe2b1fa42;cement production, CEM III/A;LAM;cement, CEM III/A;;market for cement factory;5.36e-11;unit;cement factory;;technosphere;GLO;ecoinvent_cutoff_3.9_remind_SSP2-Base_2100;cement
bdd2b0f812944c8fb5a4152de2004128;cement, all types to generic market for cement, unspecified;LAM;cement, unspecified;;market for cement, ART;0.242424242424242;kilogram;cement, ART;;technosphere;LAM;ecoinvent_cutoff_3.9_remind_SSP2-Base_2100;cement
bdd2b0f812944c8fb5a4152de2004128;cement, all types to generic market for cement, unspecified;LAM;cement, unspecified;;market for cement, type general use;0.757575757575758;kilogram;cement, type general use;;technosphere;LAM;ecoinvent_cutoff_3.9_remind_SSP2-Base_2100;cement
bea58448f40803fb16a0c59f32ed84a8;treatment of waste sealing sheet, polyethylene, municipal incineration with fly ash extraction;CH;waste sealing sheet, polyethylene;;market for cement, unspecified;0.0027201;kilogram;cement, unspecified;;technosphere;NEU;ecoinvent_cutoff_3.9_remind_SSP2-Base_2100;cement
beb3338856c0755f2fbd6d0e1e22d494;market for cement, CEM III/C;CH;cement, CEM III/C;;market for cement, CEM III/C;1.0;kilogram;cement, CEM III/C;;technosphere;NEU;ecoinvent_cutoff_3.9_remind_SSP2-Base_2100;cement
beb4a59f7cc7361919aedc7c26e09e83;sewer grid construction, 1E9l/year, 30 km;CH;sewer grid, 1E9l/year, 30 km;;market for cement, unspecified;138000.0;kilogram;cement, unspecified;;technosphere;NEU;ecoinvent_cutoff_3.9_remind_SSP2-Base_2100;cement
bf056face4e541bf8f0e8245b04f2d5a;cement production, CEM II/A-L;OAS;cement, CEM II/A-L;;market for cement factory;5.36e-11;unit;cement factory;;technosphere;GLO;ecoinvent_cutoff_3.9_remind_SSP2-Base_2100;cement
bf5c3a2cbf604b3798097bc6c318f8a6;cement production, type ICo;World;cement, type ICo;;market for cement factory;5.36e-11;unit;cement factory;;technosphere;GLO;ecoinvent_cutoff_3.9_remind_SSP2-Base_2100;cement
bf7320e8d143bec82ee53303fe2e050a;uranium fuel element production, enriched 4.2%, for light water reactor;RoW;uranium, enriched 4.2%, in fuel element for light water reactor;;market for cement, unspecified;0.006499999999999999;kilogram;cement, unspecified;;technosphere;World;ecoinvent_cutoff_3.9_remind_SSP2-Base_2100;cement
bf86ce8df62b9874946278b1fe540515;market for cement, unspecified;CA-QC;cement, unspecified;;market for cement, unspecified;1.0;kilogram;cement, unspecified;;technosphere;CAZ;ecoinvent_cutoff_3.9_remind_SSP2-Base_2100;cement
bfc1d104678945efa0ebd13f79dd718a;cement production, CP II-F;NEU;cement, CP II-F;;market for cement factory;2.73e-11;unit;cement factory;;technosphere;GLO;ecoinvent_cutoff_3.9_remind_SSP2-Base_2100;cement
bfe50a6df95d2ca57948af2034190bd0;treatment of spent activated carbon with mercury, underground deposit;DE;spent activated carbon with mercury;;market for cement mortar;0.000515;kilogram;cement mortar;;technosphere;EUR;ecoinvent_cutoff_3.9_remind_SSP2-Base_2100;cement
bfe9c1224edc4c54a2eca21d1a5bcd33;cement production, CEM IV/A;MEA;cement, CEM IV/A;;market for cement factory;5.36e-11;unit;cement factory;;technosphere;GLO;ecoinvent_cutoff_3.9_remind_SSP2-Base_2100;cement
c0f39e67ffb9dfb1a4c8475749dd42b5;electricity production, nuclear, pressure water reactor;SK;electricity, high voltage;;market for cement, Portland;9.19e-07;kilogram;cement, Portland;;technosphere;EUR;ecoinvent_cutoff_3.9_remind_SSP2-Base_2100;cement
c157e3a57f7f414b86e006cdd4253664;cement production, type I-PM;World;cement, type I-PM;;market for cement factory;5.36e-11;unit;cement factory;;technosphere;GLO;ecoinvent_cutoff_3.9_remind_SSP2-Base_2100;cement
c15d2487fa97f100312ecde8d6ccc402;treatment of waste mineral oil, hazardous waste incineration;RoW;waste mineral oil;;market for cement, unspecified;0.0045705;kilogram;cement, unspecified;;technosphere;World;ecoinvent_cutoff_3.9_remind_SSP2-Base_2100;cement
c17208d40d0c48dea314f93f9422b124;cement production, ART;LAM;cement, ART;;market for cement factory;5.36e-11;unit;cement factory;;technosphere;GLO;ecoinvent_cutoff_3.9_remind_SSP2-Base_2100;cement
c185cf61ae9647f5a6135f20f4dd9d96;cement mortar production, hand-mixed, on-site;IN;cement mortar;;market for cement, Pozzolana Portland;0.2732;kilogram;cement, Pozzolana Portland;;technosphere;IND;ecoinvent_cutoff_3.9_remind_SSP2-Base_2100;cement
